_source_file,date,program,exercise,set_no,weight_kg,reps,time_sec,iso_load,volume,notes
01_09_25 Upper A.txt,01_09_25,Upper A,Barbell Bench Press,1.0,,66.0,,,,f
01_09_25 Upper A.txt,01_09_25,Upper A,Barbell Bench Press,2.0,66.0,3.0,,,198.0,f
01_09_25 Upper A.txt,01_09_25,Upper A,Barbell Bent Over Rows,1.0,56.0,6.0,,,336.0,f
01_09_25 Upper A.txt,01_09_25,Upper A,Barbell Bent Over Rows,2.0,56.0,4.0,,,224.0,f
01_09_25 Upper A.txt,01_09_25,Upper A,Weighted Pull-Ups,1.0,,4.0,,,,f
01_09_25 Upper A.txt,01_09_25,Upper A,Weighted Pull-Ups,2.0,,3.0,,,,f ; (Neutral Grip)
01_09_25 Upper A.txt,01_09_25,Upper A,Lat Pulldown,1.0,60.0,5.0,,,300.0,f
01_09_25 Upper A.txt,01_09_25,Upper A,Lat Pulldown,2.0,,60.0,,,,f
01_09_25 Upper A.txt,01_09_25,Upper A,Incline Dumbbell Press,1.0,20.0,11.0,,,220.0,f
01_09_25 Upper A.txt,01_09_25,Upper A,Incline Dumbbell Press,2.0,20.0,7.0,,,140.0,f
01_09_25 Upper A.txt,01_09_25,Upper A,Dumbbell Lateral Raises,1.0,10.0,7.0,,,70.0,f
01_09_25 Upper A.txt,01_09_25,Upper A,Dumbbell Lateral Raises,2.0,,10.0,,,,f
01_09_25 Upper A.txt,01_09_25,Upper A,Barbell Bicep Curls,1.0,30.0,9.0,,,270.0,f
01_09_25 Upper A.txt,01_09_25,Upper A,Barbell Bicep Curls,2.0,30.0,6.0,,,180.0,f
01_09_25 Upper A.txt,01_09_25,Upper A,Overhead Cable Tricep Extension,1.0,17.0,6.0,,,102.0,f
01_09_25 Upper A.txt,01_09_25,Upper A,Overhead Cable Tricep Extension,2.0,17.0,4.0,,,68.0,f
01_09_25 Upper A.txt,01_09_25,Upper A,Reverse Pec Deck,1.0,40.0,7.0,,,280.0,f
01_09_25 Upper A.txt,01_09_25,Upper A,Reverse Pec Deck,2.0,40.0,6.0,,,240.0,f
01_09_25 Upper A.txt,01_09_25,Upper A,Hanging Knee Raises,1.0,,8.0,,,,grip f
01_09_25 Upper A.txt,01_09_25,Upper A,Hanging Knee Raises,2.0,,9.0,,,,grip
02_08_25 Upper C.txt,02_08_25,Upper C,Deadlifts,1.0,100.0,4.0,,,400.0,"grip giving out every rep, rest paused every rep"
02_08_25 Upper C.txt,02_08_25,Upper C,Deadlifts,2.0,90.0,3.0,,,270.0,failure ; (without bar weight 10kg)
02_08_25 Upper C.txt,02_08_25,Upper C,Seated Barbell Press,1.0,28.0,9.0,,,252.0,f
02_08_25 Upper C.txt,02_08_25,Upper C,Seated Barbell Press,2.0,30.0,7.0,,,210.0,f
02_08_25 Upper C.txt,02_08_25,Upper C,Lat Pulldown,1.0,50.0,7.0,,,350.0,f
02_08_25 Upper C.txt,02_08_25,Upper C,Lat Pulldown,2.0,,50.0,,,,f
02_08_25 Upper C.txt,02_08_25,Upper C,Dumbbell Lateral Raises,1.0,7.5,15.0,,,112.5,f
02_08_25 Upper C.txt,02_08_25,Upper C,Dumbbell Lateral Raises,2.0,,10.0,,,,f
02_08_25 Upper C.txt,02_08_25,Upper C,Reverse Pec Deck,1.0,35.0,11.0,,,385.0,f
02_08_25 Upper C.txt,02_08_25,Upper C,Reverse Pec Deck,2.0,35.0,10.0,,,350.0,f ; (without bar weight)
02_08_25 Upper C.txt,02_08_25,Upper C,Barbell Bicep Curls,1.0,10.0,8.0,,,80.0,f
02_08_25 Upper C.txt,02_08_25,Upper C,Barbell Bicep Curls,2.0,20.0,7.0,,,140.0,f
02_08_25 Upper C.txt,02_08_25,Upper C,Weighted Triceps Dips,1.0,,7.0,,,,f
02_08_25 Upper C.txt,02_08_25,Upper C,Weighted Triceps Dips,2.0,,6.0,,,,f
02_09_25 Lower B.txt,02_09_25,Lower B,Barbell Back Squats,1.0,74.0,4.0,,,296.0,"belt, f"
02_09_25 Lower B.txt,02_09_25,Lower B,Barbell Back Squats,2.0,74.0,2.0,,,148.0,"belt, f"
02_09_25 Lower B.txt,02_09_25,Lower B,Barbell Back Squats,3.0,64.0,4.0,,,256.0,"no belt, no rest, f ; (form is off)"
02_09_25 Lower B.txt,02_09_25,Lower B,Dumbbell RDLs,1.0,20.0,12.0,,,240.0,"f, used straps"
02_09_25 Lower B.txt,02_09_25,Lower B,Dumbbell RDLs,2.0,20.0,9.0,,,180.0,"f, used straps ; (Wide feet)"
02_09_25 Lower B.txt,02_09_25,Lower B,Leg Press,1.0,150.0,8.0,,,1200.0,f
02_09_25 Lower B.txt,02_09_25,Lower B,Leg Press,2.0,150.0,5.0,,,750.0,f
02_09_25 Lower B.txt,02_09_25,Lower B,Lying Hamstring Curls,1.0,20.0,8.0,,,160.0,f
02_09_25 Lower B.txt,02_09_25,Lower B,Lying Hamstring Curls,2.0,20.0,6.0,,,120.0,f
02_09_25 Lower B.txt,02_09_25,Lower B,Seated Calf Raises,1.0,15.0,12.0,,,180.0,f
02_09_25 Lower B.txt,02_09_25,Lower B,Seated Calf Raises,2.0,15.0,9.0,,,135.0,f
02_09_25 Lower B.txt,02_09_25,Lower B,Cable Tricep Kickbacks,1.0,6.0,7.0,,,42.0,f
02_09_25 Lower B.txt,02_09_25,Lower B,Cable Tricep Kickbacks,2.0,6.0,5.0,,,30.0,f
02_09_25 Lower B.txt,02_09_25,Lower B,Dumbbell Hammer Curls,1.0,15.0,7.0,,,105.0,f
02_09_25 Lower B.txt,02_09_25,Lower B,Dumbbell Hammer Curls,2.0,15.0,6.0,,,90.0,f
02_09_25 Lower B.txt,02_09_25,Lower B,Plank,1.0,15.0,,65.0,975.0,,
02_09_25 Lower B.txt,02_09_25,Lower B,Plank,2.0,15.0,,52.0,780.0,,
03-11-25 Upper A.txt,2025-11-03,Upper A,Barbell Bench Press,1.0,66.0,6.0,,,396.0,f
03-11-25 Upper A.txt,2025-11-03,Upper A,Barbell Bench Press,2.0,66.0,5.0,,,330.0,f
03-11-25 Upper A.txt,2025-11-03,Upper A,Weighted Pull-Ups,1.0,5.0,5.0,,,25.0,f
03-11-25 Upper A.txt,2025-11-03,Upper A,Weighted Pull-Ups,2.0,5.0,3.0,,,15.0,f
03-11-25 Upper A.txt,2025-11-03,Upper A,Barbell Overhead Press,1.0,40.0,6.0,,,240.0,f
03-11-25 Upper A.txt,2025-11-03,Upper A,Barbell Overhead Press,2.0,40.0,4.0,,,160.0,f
03-11-25 Upper A.txt,2025-11-03,Upper A,Barbell Bent Over Rows,1.0,60.0,8.0,,,480.0,f
03-11-25 Upper A.txt,2025-11-03,Upper A,Barbell Bent Over Rows,2.0,60.0,6.0,,,360.0,f
03-11-25 Upper A.txt,2025-11-03,Upper A,Incline DB Lateral Raises,1.0,7.5,11.0,,,82.5,f
03-11-25 Upper A.txt,2025-11-03,Upper A,Incline DB Lateral Raises,2.0,7.5,10.0,,,75.0,f
03-11-25 Upper A.txt,2025-11-03,Upper A,1-Arm Reverse Pec Deck,1.0,30.0,7.0,,,210.0,f
03-11-25 Upper A.txt,2025-11-03,Upper A,1-Arm Reverse Pec Deck,2.0,30.0,5.0,,,150.0,f
03-11-25 Upper A.txt,2025-11-03,Upper A,1-Arm Reverse Pec Deck,1.0,,,,,,Sec
03-11-25 Upper A.txt,2025-11-03,Upper A,1-Arm Reverse Pec Deck,2.0,,,,,,Sec ; (V - Bar)
03-11-25 Upper A.txt,2025-11-03,Upper A,Overhead Cable Tricep Extension,1.0,20.0,7.0,,,140.0,f
03-11-25 Upper A.txt,2025-11-03,Upper A,Overhead Cable Tricep Extension,2.0,20.0,5.0,,,100.0,f
03-11-25 Upper A.txt,2025-11-03,Upper A,Cable Bicep Curls,1.0,30.0,6.0,,,180.0,f
03-11-25 Upper A.txt,2025-11-03,Upper A,Cable Bicep Curls,2.0,30.0,4.0,,,120.0,f ; (Barbell)
03-11-25 Upper A.txt,2025-11-03,Upper A,Front Wrist Curls,1.0,15.0,12.0,,,180.0,f
03-11-25 Upper A.txt,2025-11-03,Upper A,Front Wrist Curls,2.0,15.0,9.0,,,135.0,f
03_09_25 Upper C.txt,03_09_25,Upper C,Seated Cable Rows,1.0,45.0,8.0,,,360.0,f
03_09_25 Upper C.txt,03_09_25,Upper C,Seated Cable Rows,2.0,45.0,5.0,,,225.0,f ; (Wide grip)
03_09_25 Upper C.txt,03_09_25,Upper C,Lat Pulldown,1.0,55.0,7.0,,,385.0,"f, with strap"
03_09_25 Upper C.txt,03_09_25,Upper C,Lat Pulldown,2.0,55.0,4.0,,,220.0,"f, without strap"
03_09_25 Upper C.txt,03_09_25,Upper C,Barbell Overhead Press,1.0,34.0,6.0,,,204.0,f
03_09_25 Upper C.txt,03_09_25,Upper C,Barbell Overhead Press,2.0,34.0,3.0,,,102.0,f
03_09_25 Upper C.txt,03_09_25,Upper C,Incline Smith Bench Press,1.0,50.0,3.0,,,150.0,f
03_09_25 Upper C.txt,03_09_25,Upper C,Incline Smith Bench Press,2.0,45.0,4.0,,,180.0,f ; (Switch to normal don't like this)
03_09_25 Upper C.txt,03_09_25,Upper C,Seated Dumbbell Reverse Fly,1.0,5.0,15.0,,,75.0,
03_09_25 Upper C.txt,03_09_25,Upper C,Seated Dumbbell Reverse Fly,2.0,5.0,14.0,,,70.0,
03_09_25 Upper C.txt,03_09_25,Upper C,Dumbbell Lateral Raises,1.0,10.0,8.0,,,80.0,f
03_09_25 Upper C.txt,03_09_25,Upper C,Dumbbell Lateral Raises,2.0,10.0,6.0,,,60.0,f ; (form not perfect)
03_09_25 Upper C.txt,03_09_25,Upper C,Dumbbell Preacher Curls,1.0,17.0,8.0,,,136.0,f
03_09_25 Upper C.txt,03_09_25,Upper C,Dumbbell Preacher Curls,2.0,17.0,4.0,,,68.0,f
03_09_25 Upper C.txt,03_09_25,Upper C,Weighted Triceps Dips,1.0,5.0,4.0,,,20.0,f
03_09_25 Upper C.txt,03_09_25,Upper C,Weighted Triceps Dips,2.0,5.0,4.0,,,20.0,"f, after 2 min rest ; (last time done 6 reps)"
03_09_25 Upper C.txt,03_09_25,Upper C,Decline Crunches,1.0,,13.0,,,,f
03_09_25 Upper C.txt,03_09_25,Upper C,Decline Crunches,2.0,,6.0,,,,f
03_09_25 Upper C.txt,03_09_25,Upper C,Push-Ups,1.0,,8.0,,,,f
03_09_25 Upper C.txt,03_09_25,Upper C,Push-Ups,2.0,,8.0,,,,f
04-11-25 Lower  B.txt,2025-11-04,Lower  B,Cable Hammer Curls,1.0,30.0,6.0,,,180.0,f
04-11-25 Lower  B.txt,2025-11-04,Lower  B,Cable Hammer Curls,2.0,30.0,4.0,,,120.0,f
04-11-25 Lower  B.txt,2025-11-04,Lower  B,Lying Hamstring Curls,1.0,25.0,6.0,,,150.0,f
04-11-25 Lower  B.txt,2025-11-04,Lower  B,Lying Hamstring Curls,2.0,25.0,5.0,,,125.0,f
04-11-25 Lower  B.txt,2025-11-04,Lower  B,Seated Calf Raises,1.0,20.0,10.0,,,200.0,f
04-11-25 Lower  B.txt,2025-11-04,Lower  B,Seated Calf Raises,2.0,20.0,8.0,,,160.0,f
04-11-25 Lower  B.txt,2025-11-04,Lower  B,Barbell Back Squats,1.0,76.0,5.0,,,380.0,"f, with belt"
04-11-25 Lower  B.txt,2025-11-04,Lower  B,Barbell Back Squats,2.0,76.0,3.0,,,228.0,"f, with belt"
04-11-25 Lower  B.txt,2025-11-04,Lower  B,Barbell RDLs,1.0,60.0,8.0,,,480.0,"f, with straps and without belt, good mmc"
04-11-25 Lower  B.txt,2025-11-04,Lower  B,Barbell RDLs,2.0,60.0,8.0,,,480.0,"f, same as before ; (Wide feet)"
04-11-25 Lower  B.txt,2025-11-04,Lower  B,Leg Press,1.0,150.0,8.0,,,1200.0,f
04-11-25 Lower  B.txt,2025-11-04,Lower  B,Leg Press,2.0,150.0,6.0,,,900.0,f
04-11-25 Lower  B.txt,2025-11-04,Lower  B,Plank,1.0,,,60.0,,,
04-11-25 Lower  B.txt,2025-11-04,Lower  B,Plank,2.0,,,,,,(skipped)
04-11-25 Lower  B.txt,2025-11-04,Lower  B,Hanging Knee Raises,1.0,,6.0,,,,"f, knee to chest"
04-11-25 Lower  B.txt,2025-11-04,Lower  B,Hanging Knee Raises,2.0,,,,,,(skipped)
05_08_25 Upper A.txt,05_08_25,Upper A,Barbell Bench Press,1.0,60.0,8.0,,,480.0,f
05_08_25 Upper A.txt,05_08_25,Upper A,Barbell Bench Press,2.0,62.0,4.0,,,248.0,f
05_08_25 Upper A.txt,05_08_25,Upper A,Weighted Pull-Ups,1.0,,5.0,,,,f
05_08_25 Upper A.txt,05_08_25,Upper A,Weighted Pull-Ups,2.0,,3.0,,,,f ; (1 rep reduced from last week)
05_08_25 Upper A.txt,05_08_25,Upper A,Barbell Bent Over Rows,1.0,50.0,8.0,,,400.0,f
05_08_25 Upper A.txt,05_08_25,Upper A,Barbell Bent Over Rows,2.0,50.0,6.0,,,300.0,f
05_08_25 Upper A.txt,05_08_25,Upper A,Incline Dumbbell Press,1.0,20.0,11.0,,,220.0,f
05_08_25 Upper A.txt,05_08_25,Upper A,Incline Dumbbell Press,2.0,20.0,12.0,,,240.0,"f, last 2 spoted"
05_08_25 Upper A.txt,05_08_25,Upper A,Dumbbell Lateral Raises,1.0,10.0,10.0,,,100.0,f
05_08_25 Upper A.txt,05_08_25,Upper A,Dumbbell Lateral Raises,2.0,,10.0,,,,f
05_08_25 Upper A.txt,05_08_25,Upper A,Seated Cable Rows,1.0,40.0,9.0,,,360.0,f
05_08_25 Upper A.txt,05_08_25,Upper A,Seated Cable Rows,2.0,40.0,10.0,,,400.0,"f, 2 rest pause"
05_08_25 Upper A.txt,05_08_25,Upper A,Overhead Cable Tricep Extension,1.0,15.0,7.0,,,105.0,f
05_08_25 Upper A.txt,05_08_25,Upper A,Overhead Cable Tricep Extension,2.0,15.0,6.0,,,90.0,f
05_08_25 Upper A.txt,05_08_25,Upper A,Face Pulls,1.0,15.0,15.0,,,225.0,
05_08_25 Upper A.txt,05_08_25,Upper A,Face Pulls,2.0,20.0,9.0,,,180.0,f
06-10-25 Upper A.txt,2025-10-06,Upper A,Barbell Bench Press,1.0,64.0,6.0,,,384.0,f
06-10-25 Upper A.txt,2025-10-06,Upper A,Barbell Bench Press,2.0,64.0,4.0,,,256.0,f
06-10-25 Upper A.txt,2025-10-06,Upper A,Barbell Bench Press,3.0,50.0,6.0,,,300.0,f
06-10-25 Upper A.txt,2025-10-06,Upper A,Weighted Pull-Ups,1.0,,4.0,,,,f
06-10-25 Upper A.txt,2025-10-06,Upper A,Weighted Pull-Ups,2.0,,3.0,,,,f
06-10-25 Upper A.txt,2025-10-06,Upper A,Weighted Pull-Ups,3.0,,3.0,,,,f
06-10-25 Upper A.txt,2025-10-06,Upper A,Weighted Pull-Ups,4.0,,2.0,,,,f
06-10-25 Upper A.txt,2025-10-06,Upper A,Barbell Bent Over Rows,1.0,60.0,7.0,,,420.0,"f, with straps"
06-10-25 Upper A.txt,2025-10-06,Upper A,Barbell Bent Over Rows,2.0,60.0,5.0,,,300.0,"f, with straps"
06-10-25 Upper A.txt,2025-10-06,Upper A,Barbell Overhead Press,1.0,40.0,4.0,,,160.0,f
06-10-25 Upper A.txt,2025-10-06,Upper A,Barbell Overhead Press,2.0,40.0,5.0,,,200.0,f
06-10-25 Upper A.txt,2025-10-06,Upper A,Incline Dumbbell Press,1.0,20.0,7.0,,,140.0,f
06-10-25 Upper A.txt,2025-10-06,Upper A,Incline Dumbbell Press,2.0,20.0,5.0,,,100.0,f
06-10-25 Upper A.txt,2025-10-06,Upper A,Incline DB Lateral Raises,1.0,7.5,11.0,,,82.5,f
06-10-25 Upper A.txt,2025-10-06,Upper A,Incline DB Lateral Raises,2.0,7.5,10.0,,,75.0,f
06-10-25 Upper A.txt,2025-10-06,Upper A,Incline DB Lateral Raises,3.0,7.5,10.0,,,75.0,f
06-10-25 Upper A.txt,2025-10-06,Upper A,1-Arm Reverse Pec Deck,1.0,25.0,7.0,,,175.0,f
06-10-25 Upper A.txt,2025-10-06,Upper A,1-Arm Reverse Pec Deck,2.0,25.0,4.0,,,100.0,f
06-10-25 Upper A.txt,2025-10-06,Upper A,1-Arm Reverse Pec Deck,3.0,20.0,7.0,,,140.0,f ; (V - Bar)
06-10-25 Upper A.txt,2025-10-06,Upper A,Overhead Cable Tricep Extension,1.0,15.0,5.0,,,75.0,f
06-10-25 Upper A.txt,2025-10-06,Upper A,Overhead Cable Tricep Extension,2.0,15.0,8.0,,,120.0,f
06-10-25 Upper A.txt,2025-10-06,Upper A,Overhead Cable Tricep Extension,3.0,15.0,5.0,,,75.0,f
06-10-25 Upper A.txt,2025-10-06,Upper A,Cable Bicep Curls,1.0,25.0,8.0,,,200.0,f
06-10-25 Upper A.txt,2025-10-06,Upper A,Cable Bicep Curls,2.0,25.0,6.0,,,150.0,f
06-10-25 Upper A.txt,2025-10-06,Upper A,Cable Bicep Curls,3.0,,25.0,,,,f
06-11-25 Upper C.txt,2025-11-06,Upper C,Barbell Overhead Press,1.0,40.0,7.0,,,280.0,f
06-11-25 Upper C.txt,2025-11-06,Upper C,Barbell Overhead Press,2.0,40.0,5.0,,,200.0,f ; (Wide grip)
06-11-25 Upper C.txt,2025-11-06,Upper C,Lat Pulldown,1.0,65.0,5.0,,,325.0,"f, without straps"
06-11-25 Upper C.txt,2025-11-06,Upper C,Lat Pulldown,2.0,65.0,3.0,,,195.0,"f, with straps"
06-11-25 Upper C.txt,2025-11-06,Upper C,Incline Barbell Bench Press,1.0,58.0,4.0,,,232.0,f
06-11-25 Upper C.txt,2025-11-06,Upper C,Incline Barbell Bench Press,2.0,58.0,3.0,,,174.0,f
06-11-25 Upper C.txt,2025-11-06,Upper C,Seated Cable Rows,1.0,55.0,4.0,,,220.0,f
06-11-25 Upper C.txt,2025-11-06,Upper C,Seated Cable Rows,2.0,50.0,4.0,,,200.0,f
06-11-25 Upper C.txt,2025-11-06,Upper C,Weighted Chin-Ups,1.0,,3.0,,,,f
06-11-25 Upper C.txt,2025-11-06,Upper C,Weighted Chin-Ups,2.0,,3.0,,,,f
06-11-25 Upper C.txt,2025-11-06,Upper C,Cable Lateral Raises,1.0,10.0,7.0,,,70.0,f
06-11-25 Upper C.txt,2025-11-06,Upper C,Cable Lateral Raises,2.0,10.0,5.0,,,50.0,f
06-11-25 Upper C.txt,2025-11-06,Upper C,Face Pulls,1.0,25.0,6.0,,,150.0,f
06-11-25 Upper C.txt,2025-11-06,Upper C,Face Pulls,2.0,25.0,4.0,,,100.0,f
06-11-25 Upper C.txt,2025-11-06,Upper C,Weighted Triceps Dips,1.0,6.0,5.0,,,30.0,f
06-11-25 Upper C.txt,2025-11-06,Upper C,Weighted Triceps Dips,2.0,6.0,4.0,,,24.0,f
06-11-25 Upper C.txt,2025-11-06,Upper C,Dumbbell Preacher Curls,1.0,22.5,6.0,,,135.0,f
06-11-25 Upper C.txt,2025-11-06,Upper C,Dumbbell Preacher Curls,2.0,22.5,4.0,,,90.0,f ; (Barbell)
06-11-25 Upper C.txt,2025-11-06,Upper C,Front Wrist Curls,1.0,15.0,14.0,,,210.0,f
06-11-25 Upper C.txt,2025-11-06,Upper C,Front Wrist Curls,2.0,15.0,10.0,,,150.0,f
06_08_25 Lower  B.txt,06_08_25,Lower  B,Barbell Back Squats,1.0,66.0,7.0,,,462.0,ctf
06_08_25 Lower  B.txt,06_08_25,Lower  B,Barbell Back Squats,2.0,68.0,4.0,,,272.0,f
06_08_25 Lower  B.txt,06_08_25,Lower  B,Dumbbell RDLs,1.0,17.5,13.0,,,227.5,ctf
06_08_25 Lower  B.txt,06_08_25,Lower  B,Dumbbell RDLs,2.0,17.5,10.0,,,175.0,f
06_08_25 Lower  B.txt,06_08_25,Lower  B,Dumbbell Preacher Curls,1.0,,17.0,,,,f
06_08_25 Lower  B.txt,06_08_25,Lower  B,Dumbbell Preacher Curls,2.0,,17.0,,,,f ; (without bar weight)
06_08_25 Lower  B.txt,06_08_25,Lower  B,EZ Bar Skull Crushers,1.0,20.0,10.0,,,200.0,ctf
06_08_25 Lower  B.txt,06_08_25,Lower  B,EZ Bar Skull Crushers,2.0,20.0,12.0,,,240.0,f ; (skipped machine fault) ; (leg extension machine fault)
06_08_25 Lower  B.txt,06_08_25,Lower  B,Lunges,1.0,10.0,10.0,,,100.0,
06_08_25 Lower  B.txt,06_08_25,Lower  B,Lunges,2.0,10.0,15.0,,,150.0,ctf
06_08_25 Lower  B.txt,06_08_25,Lower  B,Seated Calf Raises,1.0,15.0,15.0,,,225.0,ctf
06_08_25 Lower  B.txt,06_08_25,Lower  B,Seated Calf Raises,2.0,15.0,13.0,,,195.0,f
06_08_25 Lower  B.txt,06_08_25,Lower  B,Plank,1.0,10.0,,60.0,600.0,,ctf
06_08_25 Lower  B.txt,06_08_25,Lower  B,Plank,2.0,10.0,,40.0,400.0,,f
06_08_25 Lower  B.txt,06_08_25,Lower  B,L-Sit,1.0,,25.0,,,,
06_08_25 Lower  B.txt,06_08_25,Lower  B,L-Sit,2.0,,,25.0,,,
07-10-25 Lower  B.txt,2025-10-07,Lower  B,Barbell Back Squats,1.0,72.0,5.0,,,360.0,"ctf, with belt"
07-10-25 Lower  B.txt,2025-10-07,Lower  B,Barbell Back Squats,2.0,72.0,5.0,,,360.0,"f, with belt ; (Reps drop from 7 reps)"
07-10-25 Lower  B.txt,2025-10-07,Lower  B,Barbell RDLs,1.0,50.0,12.0,,,600.0,"f, with straps"
07-10-25 Lower  B.txt,2025-10-07,Lower  B,Barbell RDLs,2.0,50.0,10.0,,,500.0,"f, with straps"
07-10-25 Lower  B.txt,2025-10-07,Lower  B,Weighted Pull-Ups,1.0,,5.0,,,,f
07-10-25 Lower  B.txt,2025-10-07,Lower  B,Weighted Pull-Ups,2.0,,4.0,,,,f ; (Wide feet)
07-10-25 Lower  B.txt,2025-10-07,Lower  B,Leg Press,1.0,,,,,,Kg ×  Reps
07-10-25 Lower  B.txt,2025-10-07,Lower  B,Leg Press,2.0,,,,,,Kg ×  Reps
07-10-25 Lower  B.txt,2025-10-07,Lower  B,Lying Hamstring Curls,1.0,,,,,,f
07-10-25 Lower  B.txt,2025-10-07,Lower  B,Lying Hamstring Curls,2.0,,,,,,f
07-10-25 Lower  B.txt,2025-10-07,Lower  B,Seated Calf Raises,1.0,,,,,,f
07-10-25 Lower  B.txt,2025-10-07,Lower  B,Seated Calf Raises,2.0,,,,,,f
07-10-25 Lower  B.txt,2025-10-07,Lower  B,Plank,1.0,,,,,,f
07-10-25 Lower  B.txt,2025-10-07,Lower  B,Plank,2.0,,,,,,f
07-10-25 Lower  B.txt,2025-10-07,Lower  B,Elbow-Supported Leg Raises,1.0,,,,,,f
07-10-25 Lower  B.txt,2025-10-07,Lower  B,Elbow-Supported Leg Raises,2.0,,,,,,f
07-11-25 Lower D.txt,2025-11-07,Lower D,Deadlifts,1.0,120.0,3.0,,,360.0,"f, with straps & belt"
07-11-25 Lower D.txt,2025-11-07,Lower D,Deadlifts,2.0,120.0,2.0,,,240.0,"f, with straps & belt"
07-11-25 Lower D.txt,2025-11-07,Lower D,Leg Extension,1.0,30.0,8.0,,,240.0,f
07-11-25 Lower D.txt,2025-11-07,Lower D,Leg Extension,2.0,30.0,7.0,,,210.0,f
07-11-25 Lower D.txt,2025-11-07,Lower D,Bulgarian Split Squats,1.0,40.0,5.0,,,200.0,f
07-11-25 Lower D.txt,2025-11-07,Lower D,Bulgarian Split Squats,2.0,40.0,4.0,,,160.0,f
07-11-25 Lower D.txt,2025-11-07,Lower D,Cable Tricep Pushdowns,1.0,20.0,8.0,,,160.0,f
07-11-25 Lower D.txt,2025-11-07,Lower D,Cable Tricep Pushdowns,2.0,20.0,6.0,,,120.0,f
07-11-25 Lower D.txt,2025-11-07,Lower D,Shrugs,1.0,25.0,9.0,,,225.0,f
07-11-25 Lower D.txt,2025-11-07,Lower D,Shrugs,2.0,25.0,7.0,,,175.0,f
07-11-25 Lower D.txt,2025-11-07,Lower D,Seated Calf Raises,1.0,20.0,11.0,,,220.0,f
07-11-25 Lower D.txt,2025-11-07,Lower D,Seated Calf Raises,2.0,20.0,10.0,,,200.0,f
07-11-25 Lower D.txt,2025-11-07,Lower D,Side Plank,1.0,,,60.0,,,f
07-11-25 Lower D.txt,2025-11-07,Lower D,Decline Crunches,1.0,,15.0,,,,f
08-11-25 Sharms.txt,2025-11-08,Sharms,Seated Dumbbell Press,1.0,17.5,10.0,,,175.0,f
08-11-25 Sharms.txt,2025-11-08,Sharms,Seated Dumbbell Press,2.0,17.5,7.0,,,122.5,f
08-11-25 Sharms.txt,2025-11-08,Sharms,Cable Lateral Raises,1.0,10.0,6.0,,,60.0,f
08-11-25 Sharms.txt,2025-11-08,Sharms,Cable Lateral Raises,2.0,10.0,5.0,,,50.0,f
08-11-25 Sharms.txt,2025-11-08,Sharms,1-Arm Reverse Pec Deck,1.0,30.0,9.0,,,270.0,f
08-11-25 Sharms.txt,2025-11-08,Sharms,1-Arm Reverse Pec Deck,2.0,30.0,6.0,,,180.0,f
08-11-25 Sharms.txt,2025-11-08,Sharms,EZ Bar Skull Crushers,1.0,30.0,7.0,,,210.0,f
08-11-25 Sharms.txt,2025-11-08,Sharms,EZ Bar Skull Crushers,2.0,30.0,5.0,,,150.0,f
08-11-25 Sharms.txt,2025-11-08,Sharms,Barbell Bicep Curls,1.0,30.0,10.0,,,300.0,f
08-11-25 Sharms.txt,2025-11-08,Sharms,Barbell Bicep Curls,2.0,30.0,7.0,,,210.0,f ; (V-Bar)
08-11-25 Sharms.txt,2025-11-08,Sharms,Cable Tricep Pushdowns,1.0,25.0,8.0,,,200.0,f
08-11-25 Sharms.txt,2025-11-08,Sharms,Cable Tricep Pushdowns,2.0,25.0,7.0,,,175.0,f
08-11-25 Sharms.txt,2025-11-08,Sharms,Dumbbell Preacher Curls,1.0,,22.0,,,,"f, cluster set"
08-11-25 Sharms.txt,2025-11-08,Sharms,Dumbbell Preacher Curls,2.0,22.5,4.0,,,90.0,"f, can't do cluster set"
08-11-25 Sharms.txt,2025-11-08,Sharms,Barbell Hammer Curls,1.0,30.0,6.0,,,180.0,f
08-11-25 Sharms.txt,2025-11-08,Sharms,Barbell Hammer Curls,2.0,30.0,5.0,,,150.0,f
08-11-25 Sharms.txt,2025-11-08,Sharms,Front Wrist Curls,1.0,15.0,10.0,,,150.0,f
08-11-25 Sharms.txt,2025-11-08,Sharms,Front Wrist Curls,2.0,15.0,9.0,,,135.0,f
08_08_25 Upper C.txt,08_08_25,Upper C,Deadlifts,1.0,100.0,6.0,,,600.0,"last 2 mixed grip, ctf"
08_08_25 Upper C.txt,08_08_25,Upper C,Deadlifts,2.0,100.0,4.0,,,400.0,mixed grip and rest pause at last ; (plate weight only)
08_08_25 Upper C.txt,08_08_25,Upper C,Seated Barbell Press,1.0,30.0,8.0,,,240.0,f
08_08_25 Upper C.txt,08_08_25,Upper C,Seated Barbell Press,2.0,30.0,6.0,,,180.0,f
08_08_25 Upper C.txt,08_08_25,Upper C,Lat Pulldown,1.0,50.0,7.0,,,350.0,f
08_08_25 Upper C.txt,08_08_25,Upper C,Lat Pulldown,2.0,,50.0,,,,f
08_08_25 Upper C.txt,08_08_25,Upper C,Dumbbell Lateral Raises,1.0,,10.0,,,,f
08_08_25 Upper C.txt,08_08_25,Upper C,Dumbbell Lateral Raises,2.0,,10.0,,,,f ; (felt little on triceps)
08_08_25 Upper C.txt,08_08_25,Upper C,Reverse Pec Deck,1.0,35.0,12.0,,,420.0,f
08_08_25 Upper C.txt,08_08_25,Upper C,Reverse Pec Deck,2.0,35.0,10.0,,,350.0,f ; (plate weight only)
08_08_25 Upper C.txt,08_08_25,Upper C,Barbell Bicep Curls,1.0,20.0,8.0,,,160.0,"cn, f"
08_08_25 Upper C.txt,08_08_25,Upper C,Barbell Bicep Curls,2.0,20.0,6.0,,,120.0,"cn,f"
08_08_25 Upper C.txt,08_08_25,Upper C,Weighted Triceps Dips,1.0,,8.0,,,,f
08_08_25 Upper C.txt,08_08_25,Upper C,Weighted Triceps Dips,2.0,,6.0,,,,f
08_09_25 Lower D.txt,08_09_25,Lower D,Weighted Pull-Ups,1.0,,4.0,,,,
08_09_25 Lower D.txt,08_09_25,Lower D,Weighted Pull-Ups,2.0,,4.0,,,,f
08_09_25 Lower D.txt,08_09_25,Lower D,Deadlifts,1.0,110.0,5.0,,,550.0,"f, with straps, belt"
08_09_25 Lower D.txt,08_09_25,Lower D,Deadlifts,2.0,110.0,3.0,,,330.0,same as before
08_09_25 Lower D.txt,08_09_25,Lower D,Front Barbell Squats,1.0,30.0,8.0,,,240.0,not f
08_09_25 Lower D.txt,08_09_25,Lower D,Front Barbell Squats,2.0,30.0,8.0,,,240.0,not f
08_09_25 Lower D.txt,08_09_25,Lower D,Barbell Good Mornings,1.0,24.0,12.0,,,288.0,not f
08_09_25 Lower D.txt,08_09_25,Lower D,Barbell Good Mornings,2.0,24.0,12.0,,,288.0,same as before
08_09_25 Lower D.txt,08_09_25,Lower D,Bulgarian Split Squats,1.0,30.0,8.0,,,240.0,f
08_09_25 Lower D.txt,08_09_25,Lower D,Bulgarian Split Squats,2.0,30.0,6.0,,,180.0,f
08_09_25 Lower D.txt,08_09_25,Lower D,Shrugs,1.0,20.0,10.0,,,200.0,"f, with straps"
08_09_25 Lower D.txt,08_09_25,Lower D,Shrugs,2.0,20.0,6.0,,,120.0,"f, with straps"
08_09_25 Lower D.txt,08_09_25,Lower D,Seated Calf Raises,1.0,15.0,13.0,,,195.0,f
08_09_25 Lower D.txt,08_09_25,Lower D,Seated Calf Raises,2.0,15.0,10.0,,,150.0,f
08_09_25 Lower D.txt,08_09_25,Lower D,Reverse EZ Bar Curls,1.0,26.0,10.0,,,260.0,f
08_09_25 Lower D.txt,08_09_25,Lower D,Reverse EZ Bar Curls,2.0,26.0,7.0,,,182.0,f
08_09_25 Lower D.txt,08_09_25,Lower D,Cable Tricep Pushdowns,1.0,20.0,8.0,,,160.0,f
08_09_25 Lower D.txt,08_09_25,Lower D,Cable Tricep Pushdowns,2.0,20.0,6.0,,,120.0,f
08_09_25 Lower D.txt,08_09_25,Lower D,Front Wrist Curls,1.0,15.0,7.0,,,105.0,f
08_09_25 Lower D.txt,08_09_25,Lower D,Front Wrist Curls,2.0,15.0,5.0,,,75.0,f
08_09_25 Lower D.txt,08_09_25,Lower D,Side Plank,1.0,,,45.0,,,
08_09_25 Lower D.txt,08_09_25,Lower D,Side Plank,2.0,,,45.0,,,
09-10-25 Upper C.txt,2025-10-09,Upper C,Lat Pulldown,1.0,55.0,8.0,,,440.0,"f, no straps"
09-10-25 Upper C.txt,2025-10-09,Upper C,Lat Pulldown,2.0,55.0,5.0,,,275.0,"f, with straps"
09-10-25 Upper C.txt,2025-10-09,Upper C,Lat Pulldown,3.0,55.0,4.0,,,220.0,"f, with straps"
09-10-25 Upper C.txt,2025-10-09,Upper C,Incline Barbell Bench Press,1.0,54.0,7.0,,,378.0,f
09-10-25 Upper C.txt,2025-10-09,Upper C,Incline Barbell Bench Press,2.0,54.0,6.0,,,324.0,f
09-10-25 Upper C.txt,2025-10-09,Upper C,Seated Cable Rows,1.0,50.0,6.0,,,300.0,f
09-10-25 Upper C.txt,2025-10-09,Upper C,Seated Cable Rows,2.0,50.0,5.0,,,250.0,f
09-10-25 Upper C.txt,2025-10-09,Upper C,Weighted Chin-Ups,1.0,,6.0,,,,f
09-10-25 Upper C.txt,2025-10-09,Upper C,Weighted Chin-Ups,2.0,,4.0,,,,f
09-10-25 Upper C.txt,2025-10-09,Upper C,Weighted Chin-Ups,3.0,,3.0,,,,f
09-10-25 Upper C.txt,2025-10-09,Upper C,Incline DB Lateral Raises,1.0,7.5,20.0,,,150.0,f
09-10-25 Upper C.txt,2025-10-09,Upper C,Incline DB Lateral Raises,2.0,7.5,14.0,,,105.0,f
09-10-25 Upper C.txt,2025-10-09,Upper C,Incline DB Lateral Raises,3.0,7.5,11.0,,,82.5,f
09-10-25 Upper C.txt,2025-10-09,Upper C,Face Pulls,1.0,20.0,9.0,,,180.0,f
09-10-25 Upper C.txt,2025-10-09,Upper C,Face Pulls,2.0,20.0,8.0,,,160.0,f
09-10-25 Upper C.txt,2025-10-09,Upper C,Face Pulls,3.0,20.0,7.0,,,140.0,f
09-10-25 Upper C.txt,2025-10-09,Upper C,Dumbbell Bench Press,1.0,20.0,10.0,,,200.0,f
09-10-25 Upper C.txt,2025-10-09,Upper C,Dumbbell Bench Press,2.0,20.0,8.0,,,160.0,f
09-10-25 Upper C.txt,2025-10-09,Upper C,Dumbbell Preacher Curls,1.0,10.0,10.0,,,100.0,f
09-10-25 Upper C.txt,2025-10-09,Upper C,Dumbbell Preacher Curls,2.0,10.0,9.0,,,90.0,f
09-10-25 Upper C.txt,2025-10-09,Upper C,Weighted Triceps Dips,1.0,5.0,7.0,,,35.0,f
09-10-25 Upper C.txt,2025-10-09,Upper C,Weighted Triceps Dips,2.0,5.0,4.0,,,20.0,f
09-10-25 Upper C.txt,2025-10-09,Upper C,Front Wrist Curls,1.0,20.0,15.0,,,300.0,f
09-10-25 Upper C.txt,2025-10-09,Upper C,Reverse Wrist Curls,1.0,20.0,10.0,,,200.0,f
09_08_25 Full Body D.txt,09_08_25,Full Body D,Incline Barbell Bench Press,1.0,40.0,15.0,,,600.0,ctf
09_08_25 Full Body D.txt,09_08_25,Full Body D,Incline Barbell Bench Press,2.0,44.0,12.0,,,528.0,ctf
09_08_25 Full Body D.txt,09_08_25,Full Body D,Bulgarian Split Squats,1.0,10.0,10.0,,,100.0,
09_08_25 Full Body D.txt,09_08_25,Full Body D,Bulgarian Split Squats,2.0,,10.0,,,,(doing after a long time so stick with low weight)
09_08_25 Full Body D.txt,09_08_25,Full Body D,Shrugs,1.0,20.0,10.0,,,200.0,f
09_08_25 Full Body D.txt,09_08_25,Full Body D,Shrugs,2.0,,20.0,,,,
09_08_25 Full Body D.txt,09_08_25,Full Body D,Cable Tricep Pushdowns,1.0,20.0,8.0,,,160.0,f
09_08_25 Full Body D.txt,09_08_25,Full Body D,Cable Tricep Pushdowns,2.0,20.0,6.0,,,120.0,f
09_08_25 Full Body D.txt,09_08_25,Full Body D,Front Wrist Curls,1.0,15.0,14.0,,,210.0,f
09_08_25 Full Body D.txt,09_08_25,Full Body D,Front Wrist Curls,2.0,15.0,12.0,,,180.0,f
09_08_25 Full Body D.txt,09_08_25,Full Body D,Seated Calf Raises,1.0,15.0,13.0,,,195.0,f
09_08_25 Full Body D.txt,09_08_25,Full Body D,Seated Calf Raises,2.0,15.0,12.0,,,180.0,f
09_08_25 Full Body D.txt,09_08_25,Full Body D,Side Plank,1.0,,,60.0,,,
09_08_25 Full Body D.txt,09_08_25,Full Body D,Side Plank,2.0,,38.0,,,,
09_08_25 Full Body D.txt,09_08_25,Full Body D,Elbow-Supported Leg Raises,1.0,,18.0,,,,
09_08_25 Full Body D.txt,09_08_25,Full Body D,Elbow-Supported Leg Raises,2.0,,20.0,,,,
09_09_25 Upper A.txt,09_09_25,Upper A,Barbell Bench Press,1.0,62.0,6.0,,,372.0,f
09_09_25 Upper A.txt,09_09_25,Upper A,Barbell Bench Press,2.0,62.0,4.0,,,248.0,f
09_09_25 Upper A.txt,09_09_25,Upper A,Weighted Pull-Ups,1.0,5.0,3.0,,,15.0,f
09_09_25 Upper A.txt,09_09_25,Upper A,Weighted Pull-Ups,2.0,5.0,2.0,,,10.0,f
09_09_25 Upper A.txt,09_09_25,Upper A,Weighted Pull-Ups,3.0,5.0,2.0,,,10.0,f ; (stuck in BW × 5 reps for months)
09_09_25 Upper A.txt,09_09_25,Upper A,Barbell Bent Over Rows,1.0,56.0,7.0,,,392.0,"f, with straps"
09_09_25 Upper A.txt,09_09_25,Upper A,Barbell Bent Over Rows,2.0,56.0,5.0,,,280.0,"f, without straps"
09_09_25 Upper A.txt,09_09_25,Upper A,Reverse Pec Deck,1.0,40.0,9.0,,,360.0,f
09_09_25 Upper A.txt,09_09_25,Upper A,Reverse Pec Deck,2.0,40.0,6.0,,,240.0,f
09_09_25 Upper A.txt,09_09_25,Upper A,Dumbbell Lateral Raises,1.0,10.0,8.0,,,80.0,"f, last not perfect form"
09_09_25 Upper A.txt,09_09_25,Upper A,Dumbbell Lateral Raises,2.0,10.0,6.0,,,60.0,f ; (done with deadhangs)
09_09_25 Upper A.txt,09_09_25,Upper A,Barbell Overhead Press,1.0,30.0,3.0,,,90.0,f
09_09_25 Upper A.txt,09_09_25,Upper A,Barbell Overhead Press,2.0,30.0,4.0,,,120.0,f
09_09_25 Upper A.txt,09_09_25,Upper A,Barbell Bicep Curls,1.0,30.0,8.0,,,240.0,f
09_09_25 Upper A.txt,09_09_25,Upper A,Barbell Bicep Curls,2.0,30.0,5.0,,,150.0,f
09_09_25 Upper A.txt,09_09_25,Upper A,Overhead Cable Tricep Extension,1.0,17.0,7.0,,,119.0,f
09_09_25 Upper A.txt,09_09_25,Upper A,Overhead Cable Tricep Extension,2.0,17.0,5.0,,,85.0,f
10-10-25 Lower D.txt,2025-10-10,Lower D,Deadlifts,1.0,,110.0,,,,"f, with belt"
10-10-25 Lower D.txt,2025-10-10,Lower D,Deadlifts,2.0,110.0,5.0,,,550.0,"f, with straps and belt"
10-10-25 Lower D.txt,2025-10-10,Lower D,Deadlifts,3.0,,100.0,,,,
10-10-25 Lower D.txt,2025-10-10,Lower D,Weighted Pull-Ups,1.0,,3.0,,,,f
10-10-25 Lower D.txt,2025-10-10,Lower D,Weighted Pull-Ups,2.0,,6.0,,,,f) (had 2-3 min rest
10-10-25 Lower D.txt,2025-10-10,Lower D,Barbell Good Mornings,1.0,30.0,10.0,,,300.0,ctf
10-10-25 Lower D.txt,2025-10-10,Lower D,Barbell Good Mornings,2.0,34.0,10.0,,,340.0,ctf
10-10-25 Lower D.txt,2025-10-10,Lower D,Bulgarian Split Squats,1.0,34.0,7.0,,,238.0,f
10-10-25 Lower D.txt,2025-10-10,Lower D,Bulgarian Split Squats,2.0,34.0,6.0,,,204.0,f
10-10-25 Lower D.txt,2025-10-10,Lower D,Shrugs,1.0,60.0,4.0,,,240.0,"f, with straps"
10-10-25 Lower D.txt,2025-10-10,Lower D,Shrugs,2.0,60.0,6.0,,,360.0,"f, with straps"
10-10-25 Lower D.txt,2025-10-10,Lower D,Seated Calf Raises,1.0,20.0,7.0,,,140.0,f
10-10-25 Lower D.txt,2025-10-10,Lower D,Seated Calf Raises,2.0,20.0,5.0,,,100.0,f
10-10-25 Lower D.txt,2025-10-10,Lower D,Side Plank,1.0,,,45.0,,,
10-10-25 Lower D.txt,2025-10-10,Lower D,Side Plank,2.0,,,38.0,,,
10-10-25 Lower D.txt,2025-10-10,Lower D,Decline Crunches,1.0,,8.0,,,,f
10-10-25 Lower D.txt,2025-10-10,Lower D,Decline Crunches,2.0,,6.0,,,,f
10-11-25 Upper A.txt,2025-11-10,Upper A,Barbell Bench Press,1.0,66.0,5.0,,,330.0,f
10-11-25 Upper A.txt,2025-11-10,Upper A,Barbell Bench Press,2.0,66.0,3.0,,,198.0,
10-11-25 Upper A.txt,2025-11-10,Upper A,Barbell Bench Press,3.0,50.0,6.0,,,300.0,f
10-11-25 Upper A.txt,2025-11-10,Upper A,Weighted Pull-Ups,1.0,,5.0,,,,
10-11-25 Upper A.txt,2025-11-10,Upper A,Weighted Pull-Ups,2.0,,2.0,,,,
10-11-25 Upper A.txt,2025-11-10,Upper A,Lat Pulldown,1.0,60.0,4.0,,,240.0,f
10-11-25 Upper A.txt,2025-11-10,Upper A,Lat Pulldown,2.0,60.0,3.0,,,180.0,f
10-11-25 Upper A.txt,2025-11-10,Upper A,Chest Pec Deck,1.0,50.0,5.0,,,250.0,
10-11-25 Upper A.txt,2025-11-10,Upper A,Chest Pec Deck,2.0,,40.0,,,,f
10-11-25 Upper A.txt,2025-11-10,Upper A,Seated DB Overhead Press,1.0,17.5,8.0,,,140.0,f
10-11-25 Upper A.txt,2025-11-10,Upper A,Seated DB Overhead Press,2.0,17.5,6.0,,,105.0,f
10-11-25 Upper A.txt,2025-11-10,Upper A,Barbell Bent Over Rows,1.0,60.0,6.0,,,360.0,f
10-11-25 Upper A.txt,2025-11-10,Upper A,Barbell Bent Over Rows,2.0,60.0,4.0,,,240.0,f ; (Drop Set)
10-11-25 Upper A.txt,2025-11-10,Upper A,Dumbbell Lateral Raises,1.0,,10.0,,,,
10-11-25 Upper A.txt,2025-11-10,Upper A,Dumbbell Lateral Raises,,6.0,7.0,,,42.0,(Drop Set)
10-11-25 Upper A.txt,2025-11-10,Upper A,Reverse Pec Deck,1.0,40.0,5.0,,,200.0,
10-11-25 Upper A.txt,2025-11-10,Upper A,Reverse Pec Deck,2.0,,30.0,,,,
10-11-25 Upper A.txt,2025-11-10,Upper A,Reverse Pec Deck,3.0,20.0,10.0,,,200.0,f ; (V - Bar) (Drop Set)
10-11-25 Upper A.txt,2025-11-10,Upper A,Overhead Cable Tricep Extension,1.0,20.0,8.0,,,160.0,
10-11-25 Upper A.txt,2025-11-10,Upper A,Overhead Cable Tricep Extension,2.0,,15.0,,,,
10-11-25 Upper A.txt,2025-11-10,Upper A,Overhead Cable Tricep Extension,3.0,,10.0,,,,
10-11-25 Upper A.txt,2025-11-10,Upper A,Overhead Cable Tricep Extension,4.0,5.0,3.0,,,15.0,f ; (Drop Set)
10-11-25 Upper A.txt,2025-11-10,Upper A,Cable Bicep Curls,1.0,30.0,7.0,,,210.0,
10-11-25 Upper A.txt,2025-11-10,Upper A,Cable Bicep Curls,2.0,,25.0,,,,
10-11-25 Upper A.txt,2025-11-10,Upper A,Cable Bicep Curls,3.0,,20.0,,,,
10-11-25 Upper A.txt,2025-11-10,Upper A,Cable Bicep Curls,4.0,,15.0,,,,
10-11-25 Upper A.txt,2025-11-10,Upper A,Cable Bicep Curls,5.0,,10.0,,,,
10-11-25 Upper A.txt,2025-11-10,Upper A,Cable Bicep Curls,6.0,,5.0,,,,f ; (Cable)
10-11-25 Upper A.txt,2025-11-10,Upper A,Front Wrist Curls,1.0,20.0,10.0,,,200.0,
10_07_25 Torso A.txt,10_07_25,Torso A,Barbell Bench Press,1.0,30.0,8.0,,,240.0,
10_07_25 Torso A.txt,10_07_25,Torso A,Barbell Bench Press,2.0,30.0,8.0,,,240.0,
10_07_25 Torso A.txt,10_07_25,Torso A,Chest Pec Deck,1.0,25.0,8.0,,,200.0,
10_07_25 Torso A.txt,10_07_25,Torso A,Chest Pec Deck,2.0,25.0,8.0,,,200.0,
10_07_25 Torso A.txt,10_07_25,Torso A,Seated DB Overhead Press,1.0,10.0,8.0,,,80.0,
10_07_25 Torso A.txt,10_07_25,Torso A,Seated DB Overhead Press,2.0,10.0,8.0,,,80.0,
10_07_25 Torso A.txt,10_07_25,Torso A,Dumbbell Lateral Raises,1.0,5.0,8.0,,,40.0,
10_07_25 Torso A.txt,10_07_25,Torso A,Dumbbell Lateral Raises,2.0,5.0,8.0,,,40.0,
10_07_25 Torso A.txt,10_07_25,Torso A,Reverse Pec Deck,1.0,25.0,8.0,,,200.0,
10_07_25 Torso A.txt,10_07_25,Torso A,Reverse Pec Deck,2.0,25.0,8.0,,,200.0,
10_07_25 Torso A.txt,10_07_25,Torso A,Lat Pulldown,1.0,30.0,8.0,,,240.0,
10_07_25 Torso A.txt,10_07_25,Torso A,Lat Pulldown,2.0,30.0,8.0,,,240.0,
10_07_25 Torso A.txt,10_07_25,Torso A,Seated Cable Rows,1.0,30.0,8.0,,,240.0,
10_07_25 Torso A.txt,10_07_25,Torso A,Seated Cable Rows,2.0,30.0,8.0,,,240.0,
10_07_25 Torso A.txt,10_07_25,Torso A,Front Wrist Curls,1.0,15.0,8.0,,,120.0,
10_07_25 Torso A.txt,10_07_25,Torso A,Front Wrist Curls,2.0,15.0,8.0,,,120.0,
10_07_25 Torso A.txt,10_07_25,Torso A,Reverse Wrist Curls,1.0,10.0,8.0,,,80.0,
10_07_25 Torso A.txt,10_07_25,Torso A,Reverse Wrist Curls,2.0,15.0,8.0,,,120.0,
10_09_25 Lower  B.txt,10_09_25,Lower  B,Barbell Back Squats,1.0,70.0,7.0,,,490.0,"ctf, 1-2 RIR"
10_09_25 Lower  B.txt,10_09_25,Lower  B,Barbell Back Squats,2.0,70.0,4.0,,,280.0,f
10_09_25 Lower  B.txt,10_09_25,Lower  B,Barbell RDLs,1.0,40.0,10.0,,,400.0,"f, last 2-3 reps felt on lower spine"
10_09_25 Lower  B.txt,10_09_25,Lower  B,Barbell RDLs,2.0,40.0,12.0,,,480.0,"f, no discomfort, MMC ok ; (good MMC at 30kg) ; (Wide feet)"
10_09_25 Lower  B.txt,10_09_25,Lower  B,Leg Press,1.0,150.0,8.0,,,1200.0,f
10_09_25 Lower  B.txt,10_09_25,Lower  B,Leg Press,2.0,150.0,6.0,,,900.0,f ; (harder than last time)
10_09_25 Lower  B.txt,10_09_25,Lower  B,Lying Hamstring Curls,1.0,20.0,9.0,,,180.0,f
10_09_25 Lower  B.txt,10_09_25,Lower  B,Lying Hamstring Curls,2.0,20.0,6.0,,,120.0,f
10_09_25 Lower  B.txt,10_09_25,Lower  B,Seated Calf Raises,1.0,15.0,13.0,,,195.0,f
10_09_25 Lower  B.txt,10_09_25,Lower  B,Seated Calf Raises,2.0,15.0,11.0,,,165.0,f
10_09_25 Lower  B.txt,10_09_25,Lower  B,Plank,1.0,,,58.0,,,f
10_09_25 Lower  B.txt,10_09_25,Lower  B,Plank,2.0,,,37.0,,,f
10_09_25 Lower  B.txt,10_09_25,Lower  B,Elbow-Supported Leg Raises,1.0,,17.0,,,,f
10_09_25 Lower  B.txt,10_09_25,Lower  B,Elbow-Supported Leg Raises,2.0,,18.0,,,,f
11-11-25 Lower  B.txt,2025-11-11,Lower  B,Cable Hammer Curls,1.0,30.0,7.0,,,210.0,f
11-11-25 Lower  B.txt,2025-11-11,Lower  B,Cable Hammer Curls,2.0,30.0,5.0,,,150.0,f
11-11-25 Lower  B.txt,2025-11-11,Lower  B,Lying Hamstring Curls,1.0,20.0,7.0,,,140.0,f
11-11-25 Lower  B.txt,2025-11-11,Lower  B,Lying Hamstring Curls,2.0,20.0,6.0,,,120.0,f
11-11-25 Lower  B.txt,2025-11-11,Lower  B,Seated Calf Raises,1.0,20.0,12.0,,,240.0,f
11-11-25 Lower  B.txt,2025-11-11,Lower  B,Seated Calf Raises,2.0,20.0,10.0,,,200.0,1-2 RIR
11-11-25 Lower  B.txt,2025-11-11,Lower  B,Barbell Back Squats,1.0,,76.0,,,,"f, cluster set"
11-11-25 Lower  B.txt,2025-11-11,Lower  B,Barbell Back Squats,2.0,76.0,3.0,,,228.0,f
11-11-25 Lower  B.txt,2025-11-11,Lower  B,Barbell RDLs,1.0,60.0,9.0,,,540.0,"f, with straps"
11-11-25 Lower  B.txt,2025-11-11,Lower  B,Barbell RDLs,2.0,60.0,7.0,,,420.0,"f, with straps"
12_07_25 Limbs A.txt,12_07_25,Limbs A,EZ Bar Bicep Curls,1.0,8.0,8.0,,,64.0,weight both sides
12_07_25 Limbs A.txt,12_07_25,Limbs A,EZ Bar Bicep Curls,2.0,8.0,8.0,,,64.0,
12_07_25 Limbs A.txt,12_07_25,Limbs A,Cable Tricep Pushdowns,1.0,20.0,7.0,,,140.0,
12_07_25 Limbs A.txt,12_07_25,Limbs A,Cable Tricep Pushdowns,2.0,20.0,6.0,,,120.0,
12_07_25 Limbs A.txt,12_07_25,Limbs A,Dumbbell Hammer Curls,1.0,20.0,8.0,,,160.0,
12_07_25 Limbs A.txt,12_07_25,Limbs A,Dumbbell Hammer Curls,2.0,25.0,6.0,,,150.0,last half
12_07_25 Limbs A.txt,12_07_25,Limbs A,Overhead Cable Tricep Extension,1.0,15.0,8.0,,,120.0,
12_07_25 Limbs A.txt,12_07_25,Limbs A,Overhead Cable Tricep Extension,2.0,20.0,8.0,,,160.0,
12_07_25 Limbs A.txt,12_07_25,Limbs A,Barbell Back Squats,1.0,50.0,7.0,,,350.0,"plate weight, failure"
12_07_25 Limbs A.txt,12_07_25,Limbs A,Barbell Back Squats,2.0,50.0,6.0,,,300.0,failure
12_07_25 Limbs A.txt,12_07_25,Limbs A,Lunges,1.0,10.0,8.0,,,80.0,
12_07_25 Limbs A.txt,12_07_25,Limbs A,Lunges,2.0,12.5,8.0,,,100.0,failure
12_07_25 Limbs A.txt,12_07_25,Limbs A,Lying Hamstring Curls,1.0,20.0,8.0,,,160.0,
12_07_25 Limbs A.txt,12_07_25,Limbs A,Lying Hamstring Curls,2.0,25.0,7.0,,,175.0,
12_07_25 Limbs A.txt,12_07_25,Limbs A,Leg Extension,1.0,25.0,8.0,,,200.0,
12_07_25 Limbs A.txt,12_07_25,Limbs A,Leg Extension,2.0,30.0,7.0,,,210.0,
12_07_25 Limbs A.txt,12_07_25,Limbs A,Seated Calf Raises,1.0,20.0,12.0,,,240.0,
12_07_25 Limbs A.txt,12_07_25,Limbs A,Seated Calf Raises,2.0,25.0,8.0,,,200.0,
12_07_25 Limbs A.txt,12_07_25,Limbs A,Plank,1.0,,,60.0,,,
12_07_25 Limbs A.txt,12_07_25,Limbs A,Plank,2.0,5.0,,31.0,155.0,,
12_07_25 Limbs A.txt,12_07_25,Limbs A,Hanging Leg Raises,1.0,,15.0,,,,
12_07_25 Limbs A.txt,12_07_25,Limbs A,Hanging Leg Raises,2.0,,8.0,,,,
12_08_25 Upper A.txt,12_08_25,Upper A,Barbell Bench Press,1.0,64.0,4.0,,,256.0,ctf
12_08_25 Upper A.txt,12_08_25,Upper A,Barbell Bench Press,2.0,64.0,4.0,,,256.0,f
12_08_25 Upper A.txt,12_08_25,Upper A,Barbell Bench Press,3.0,50.0,8.0,,,400.0,f
12_08_25 Upper A.txt,12_08_25,Upper A,Barbell Bent Over Rows,1.0,50.0,8.0,,,400.0,f
12_08_25 Upper A.txt,12_08_25,Upper A,Barbell Bent Over Rows,2.0,50.0,6.0,,,300.0,f
12_08_25 Upper A.txt,12_08_25,Upper A,Weighted Pull-Ups,1.0,,5.0,,,,f
12_08_25 Upper A.txt,12_08_25,Upper A,Weighted Pull-Ups,2.0,,4.0,,,,f ; (total weight including barbell)
12_08_25 Upper A.txt,12_08_25,Upper A,Barbell Overhead Press,1.0,42.0,4.0,,,168.0,f
12_08_25 Upper A.txt,12_08_25,Upper A,Barbell Overhead Press,2.0,40.0,6.0,,,240.0,f ; (last week done 40kg for 8 reps)
12_08_25 Upper A.txt,12_08_25,Upper A,Dumbbell Lateral Raises,1.0,10.0,9.0,,,90.0,f
12_08_25 Upper A.txt,12_08_25,Upper A,Dumbbell Lateral Raises,2.0,,10.0,,,,f ; (form not perfect but good)
12_08_25 Upper A.txt,12_08_25,Upper A,Incline Dumbbell Press,1.0,20.0,10.0,,,200.0,f
12_08_25 Upper A.txt,12_08_25,Upper A,Incline Dumbbell Press,2.0,20.0,9.0,,,180.0,f ; (total weight)
12_08_25 Upper A.txt,12_08_25,Upper A,Barbell Bicep Curls,1.0,30.0,7.0,,,210.0,f
12_08_25 Upper A.txt,12_08_25,Upper A,Barbell Bicep Curls,2.0,30.0,6.0,,,180.0,f
12_08_25 Upper A.txt,12_08_25,Upper A,Overhead Cable Tricep Extension,1.0,15.0,7.0,,,105.0,f
12_08_25 Upper A.txt,12_08_25,Upper A,Overhead Cable Tricep Extension,2.0,15.0,8.0,,,120.0,f
12_08_25 Upper A.txt,12_08_25,Upper A,Reverse Pec Deck,1.0,35.0,12.0,,,420.0,f
12_08_25 Upper A.txt,12_08_25,Upper A,Reverse Pec Deck,2.0,40.0,8.0,,,320.0,f
12_08_25 Upper A.txt,12_08_25,Upper A,Hanging Knee Raises,1.0,,10.0,,,,leg raises can't control swing
12_08_25 Upper A.txt,12_08_25,Upper A,Hanging Knee Raises,2.0,,12.0,,,,"controlled,knee"
12_08_25 Upper A.txt,12_08_25,Upper A,Dead Hangs,1.0,,,40.0,,,
12_09_25 Upper C.txt,12_09_25,Upper C,Lat Pulldown,1.0,55.0,5.0,,,275.0,"f, no straps"
12_09_25 Upper C.txt,12_09_25,Upper C,Lat Pulldown,2.0,55.0,7.0,,,385.0,"f, with straps"
12_09_25 Upper C.txt,12_09_25,Upper C,Lat Pulldown,3.0,55.0,4.0,,,220.0,"f, with straps"
12_09_25 Upper C.txt,12_09_25,Upper C,Incline Barbell Bench Press,1.0,52.0,7.0,,,364.0,ctf
12_09_25 Upper C.txt,12_09_25,Upper C,Incline Barbell Bench Press,2.0,52.0,5.0,,,260.0,f
12_09_25 Upper C.txt,12_09_25,Upper C,Seated Cable Rows,1.0,45.0,8.0,,,360.0,f
12_09_25 Upper C.txt,12_09_25,Upper C,Seated Cable Rows,2.0,45.0,6.0,,,270.0,f
12_09_25 Upper C.txt,12_09_25,Upper C,Seated Cable Rows,3.0,40.0,5.0,,,200.0,f ; (Note: Stick with 40kg untill no pain in scapula)
12_09_25 Upper C.txt,12_09_25,Upper C,Dumbbell Lateral Raises,1.0,7.5,15.0,,,112.5,ctf
12_09_25 Upper C.txt,12_09_25,Upper C,Dumbbell Lateral Raises,2.0,7.5,15.0,,,112.5,ctf
12_09_25 Upper C.txt,12_09_25,Upper C,Dumbbell Lateral Raises,3.0,,7.0,,,,f
12_09_25 Upper C.txt,12_09_25,Upper C,Seated Dumbbell Reverse Fly,1.0,5.0,15.0,,,75.0,
12_09_25 Upper C.txt,12_09_25,Upper C,Seated Dumbbell Reverse Fly,2.0,5.0,18.0,,,90.0,f
12_09_25 Upper C.txt,12_09_25,Upper C,Dumbbell Preacher Curls,1.0,17.0,9.0,,,153.0,f
12_09_25 Upper C.txt,12_09_25,Upper C,Dumbbell Preacher Curls,2.0,17.0,7.0,,,119.0,f
12_09_25 Upper C.txt,12_09_25,Upper C,Weighted Triceps Dips,1.0,5.0,8.0,,,40.0,f
12_09_25 Upper C.txt,12_09_25,Upper C,Weighted Triceps Dips,2.0,5.0,5.0,,,25.0,f
13-10-25 Upper A.txt,2025-10-13,Upper A,Barbell Bench Press,1.0,64.0,6.0,,,384.0,f
13-10-25 Upper A.txt,2025-10-13,Upper A,Barbell Bench Press,2.0,64.0,4.0,,,256.0,f
13-10-25 Upper A.txt,2025-10-13,Upper A,Weighted Pull-Ups,1.0,,5.0,,,,
13-10-25 Upper A.txt,2025-10-13,Upper A,Weighted Pull-Ups,2.0,,5.0,,,,
13-10-25 Upper A.txt,2025-10-13,Upper A,Lat Pulldown,1.0,,50.0,,,,f
13-10-25 Upper A.txt,2025-10-13,Upper A,Lat Pulldown,2.0,50.0,3.0,,,150.0,f
13-10-25 Upper A.txt,2025-10-13,Upper A,Barbell Bent Over Rows,1.0,60.0,7.0,,,420.0,f
13-10-25 Upper A.txt,2025-10-13,Upper A,Barbell Bent Over Rows,2.0,60.0,6.0,,,360.0,f
13-10-25 Upper A.txt,2025-10-13,Upper A,Barbell Overhead Press,1.0,40.0,5.0,,,200.0,f
13-10-25 Upper A.txt,2025-10-13,Upper A,Barbell Overhead Press,2.0,40.0,3.0,,,120.0,f
13-10-25 Upper A.txt,2025-10-13,Upper A,Incline DB Lateral Raises,1.0,7.5,10.0,,,75.0,f
13-10-25 Upper A.txt,2025-10-13,Upper A,Incline DB Lateral Raises,2.0,7.5,8.0,,,60.0,
13-10-25 Upper A.txt,2025-10-13,Upper A,1-Arm Reverse Pec Deck,1.0,25.0,7.0,,,175.0,f
13-10-25 Upper A.txt,2025-10-13,Upper A,1-Arm Reverse Pec Deck,2.0,25.0,5.0,,,125.0,(V - Bar)
13-10-25 Upper A.txt,2025-10-13,Upper A,Overhead Cable Tricep Extension,1.0,15.0,8.0,,,120.0,f
13-10-25 Upper A.txt,2025-10-13,Upper A,Overhead Cable Tricep Extension,2.0,15.0,6.0,,,90.0,f
13-10-25 Upper A.txt,2025-10-13,Upper A,Cable Bicep Curls,1.0,25.0,7.0,,,175.0,f
13-10-25 Upper A.txt,2025-10-13,Upper A,Cable Bicep Curls,2.0,25.0,5.0,,,125.0,f
13-10-25 Upper A.txt,2025-10-13,Upper A,Front Wrist Curls,1.0,20.0,13.0,,,260.0,
13-10-25 Upper A.txt,2025-10-13,Upper A,Reverse Wrist Curls,1.0,20.0,8.0,,,160.0,
13-11-25 Upper C.txt,2025-11-13,Upper C,Barbell Overhead Press,1.0,40.0,8.0,,,320.0,f
13-11-25 Upper C.txt,2025-11-13,Upper C,Barbell Overhead Press,2.0,40.0,5.0,,,200.0,f ; (Wide grip)
13-11-25 Upper C.txt,2025-11-13,Upper C,Lat Pulldown,1.0,65.0,4.0,,,260.0,"f, without straps"
13-11-25 Upper C.txt,2025-11-13,Upper C,Lat Pulldown,2.0,60.0,6.0,,,360.0,"f, without straps"
13-11-25 Upper C.txt,2025-11-13,Upper C,Seated Cable Rows,1.0,50.0,6.0,,,300.0,f
13-11-25 Upper C.txt,2025-11-13,Upper C,Seated Cable Rows,2.0,50.0,5.0,,,250.0,f
13-11-25 Upper C.txt,2025-11-13,Upper C,Incline Barbell Bench Press,1.0,60.0,5.0,,,300.0,f
13-11-25 Upper C.txt,2025-11-13,Upper C,Incline Barbell Bench Press,2.0,60.0,4.0,,,240.0,f
13-11-25 Upper C.txt,2025-11-13,Upper C,Weighted Chin-Ups,1.0,,5.0,,,,f
13-11-25 Upper C.txt,2025-11-13,Upper C,Weighted Chin-Ups,2.0,,3.0,,,,f
13-11-25 Upper C.txt,2025-11-13,Upper C,Cable Lateral Raises,1.0,10.0,11.0,,,110.0,f
13-11-25 Upper C.txt,2025-11-13,Upper C,Cable Lateral Raises,2.0,10.0,9.0,,,90.0,f
13-11-25 Upper C.txt,2025-11-13,Upper C,Face Pulls,1.0,20.0,10.0,,,200.0,f
13-11-25 Upper C.txt,2025-11-13,Upper C,Face Pulls,2.0,20.0,8.0,,,160.0,f
13-11-25 Upper C.txt,2025-11-13,Upper C,Dumbbell Preacher Curls,1.0,22.5,5.0,,,112.5,f
13-11-25 Upper C.txt,2025-11-13,Upper C,Dumbbell Preacher Curls,2.0,,22.0,,,,"f, cluster"
13-11-25 Upper C.txt,2025-11-13,Upper C,Weighted Triceps Dips,1.0,,10.0,,,,"f, cluster"
13-11-25 Upper C.txt,2025-11-13,Upper C,Weighted Triceps Dips,2.0,,10.0,,,,"f, cluster ; (Cable)"
13-11-25 Upper C.txt,2025-11-13,Upper C,Front Wrist Curls,1.0,25.0,15.0,,,375.0,
13_08_25 Lower  B.txt,13_08_25,Lower  B,Barbell Back Squats,1.0,70.0,6.0,,,420.0,"ctf, little form brake"
13_08_25 Lower  B.txt,13_08_25,Lower  B,Barbell Back Squats,2.0,70.0,4.0,,,280.0,"f, with belt"
13_08_25 Lower  B.txt,13_08_25,Lower  B,Barbell Back Squats,3.0,50.0,9.0,,,450.0,f
13_08_25 Lower  B.txt,13_08_25,Lower  B,Dumbbell RDLs,1.0,20.0,10.0,,,200.0,ctf
13_08_25 Lower  B.txt,13_08_25,Lower  B,Dumbbell RDLs,2.0,20.0,10.0,,,200.0,f
13_08_25 Lower  B.txt,13_08_25,Lower  B,Leg Press,1.0,150.0,8.0,,,1200.0,f
13_08_25 Lower  B.txt,13_08_25,Lower  B,Leg Press,2.0,150.0,6.0,,,900.0,f ; (machine fault)
13_08_25 Lower  B.txt,13_08_25,Lower  B,Seated Calf Raises,1.0,20.0,10.0,,,200.0,ctf
13_08_25 Lower  B.txt,13_08_25,Lower  B,Seated Calf Raises,2.0,20.0,10.0,,,200.0,f
13_08_25 Lower  B.txt,13_08_25,Lower  B,Cable Tricep Kickbacks,1.0,5.0,10.0,,,50.0,f
13_08_25 Lower  B.txt,13_08_25,Lower  B,Cable Tricep Kickbacks,2.0,5.0,8.0,,,40.0,f
13_08_25 Lower  B.txt,13_08_25,Lower  B,Dumbbell Hammer Curls,1.0,10.0,12.0,,,120.0,f
13_08_25 Lower  B.txt,13_08_25,Lower  B,Dumbbell Hammer Curls,2.0,10.0,11.0,,,110.0,f
13_08_25 Lower  B.txt,13_08_25,Lower  B,Plank,1.0,10.0,,60.0,600.0,,
13_08_25 Lower  B.txt,13_08_25,Lower  B,Plank,2.0,10.0,,75.0,750.0,,f
13_09_25 Lower D.txt,13_09_25,Lower D,Deadlifts,1.0,110.0,5.0,,,550.0,"f, with straps, no belt"
13_09_25 Lower D.txt,13_09_25,Lower D,Deadlifts,2.0,110.0,4.0,,,440.0,"f, with straps and belt"
13_09_25 Lower D.txt,13_09_25,Lower D,Deadlifts,3.0,,100.0,,,,for grip ; (can't even lift 110 without straps)
13_09_25 Lower D.txt,13_09_25,Lower D,Barbell Good Mornings,1.0,30.0,9.0,,,270.0,no mmc and litte lower back pain
13_09_25 Lower D.txt,13_09_25,Lower D,Barbell Good Mornings,2.0,30.0,12.0,,,360.0,"mmc ok, no lower back pain untill last reps"
13_09_25 Lower D.txt,13_09_25,Lower D,Bulgarian Split Squats,1.0,30.0,10.0,,,300.0,ctf
13_09_25 Lower D.txt,13_09_25,Lower D,Bulgarian Split Squats,2.0,30.0,11.0,,,330.0,f
13_09_25 Lower D.txt,13_09_25,Lower D,Shrugs,1.0,20.0,12.0,,,240.0,f
13_09_25 Lower D.txt,13_09_25,Lower D,Shrugs,2.0,20.0,9.0,,,180.0,f
13_09_25 Lower D.txt,13_09_25,Lower D,Seated Calf Raises,1.0,15.0,13.0,,,195.0,f
13_09_25 Lower D.txt,13_09_25,Lower D,Seated Calf Raises,2.0,15.0,11.0,,,165.0,f
13_09_25 Lower D.txt,13_09_25,Lower D,Side Plank,1.0,,,45.0,,,f
13_09_25 Lower D.txt,13_09_25,Lower D,Side Plank,2.0,,,36.0,,,f
13_09_25 Lower D.txt,13_09_25,Lower D,Decline Crunches,1.0,,9.0,,,,f
13_09_25 Lower D.txt,13_09_25,Lower D,Decline Crunches,2.0,,8.0,,,,f
14-10-25 Lower  B.txt,2025-10-14,Lower  B,Barbell Back Squats,1.0,72.0,6.0,,,432.0,ctf
14-10-25 Lower  B.txt,2025-10-14,Lower  B,Barbell Back Squats,2.0,72.0,4.0,,,288.0,f
14-10-25 Lower  B.txt,2025-10-14,Lower  B,Barbell RDLs,1.0,60.0,8.0,,,480.0,"f, with straps & belt"
14-10-25 Lower  B.txt,2025-10-14,Lower  B,Barbell RDLs,2.0,60.0,7.0,,,420.0,"f, with straps & belt ; (Wide feet)"
14-10-25 Lower  B.txt,2025-10-14,Lower  B,Leg Press,1.0,140.0,9.0,,,1260.0,f
14-10-25 Lower  B.txt,2025-10-14,Lower  B,Leg Press,2.0,140.0,8.0,,,1120.0,f
14-10-25 Lower  B.txt,2025-10-14,Lower  B,Lying Hamstring Curls,1.0,20.0,8.0,,,160.0,f
14-10-25 Lower  B.txt,2025-10-14,Lower  B,Lying Hamstring Curls,2.0,20.0,7.0,,,140.0,f
14-10-25 Lower  B.txt,2025-10-14,Lower  B,Seated Calf Raises,1.0,20.0,7.0,,,140.0,f
14-10-25 Lower  B.txt,2025-10-14,Lower  B,Seated Calf Raises,2.0,,20.0,,,,f
14-10-25 Lower  B.txt,2025-10-14,Lower  B,Plank,1.0,,,90.0,,,f
14-10-25 Lower  B.txt,2025-10-14,Lower  B,Plank,2.0,,,47.0,,,f
14-10-25 Lower  B.txt,2025-10-14,Lower  B,Elbow-Supported Leg Raises,1.0,,20.0,,,,
14-10-25 Lower  B.txt,2025-10-14,Lower  B,Elbow-Supported Leg Raises,2.0,,14.0,,,,
14_07_25 Torso A.txt,14_07_25,Torso A,Barbell Bench Press,1.0,44.0,6.0,,,264.0,
14_07_25 Torso A.txt,14_07_25,Torso A,Barbell Bench Press,2.0,44.0,8.0,,,352.0,
14_07_25 Torso A.txt,14_07_25,Torso A,Incline Barbell Bench Press,1.0,30.0,8.0,,,240.0,
14_07_25 Torso A.txt,14_07_25,Torso A,Incline Barbell Bench Press,2.0,34.0,8.0,,,272.0,
14_07_25 Torso A.txt,14_07_25,Torso A,Chest Pec Deck,1.0,40.0,8.0,,,320.0,
14_07_25 Torso A.txt,14_07_25,Torso A,Chest Pec Deck,2.0,45.0,6.0,,,270.0,last 1 half
14_07_25 Torso A.txt,14_07_25,Torso A,Cable Lateral Raises,1.0,5.0,12.0,,,60.0,
14_07_25 Torso A.txt,14_07_25,Torso A,Cable Lateral Raises,2.0,5.0,8.0,,,40.0,
14_07_25 Torso A.txt,14_07_25,Torso A,Reverse Pec Deck,1.0,30.0,8.0,,,240.0,
14_07_25 Torso A.txt,14_07_25,Torso A,Reverse Pec Deck,2.0,35.0,6.0,,,210.0,last one half
14_07_25 Torso A.txt,14_07_25,Torso A,Deadlifts,1.0,40.0,8.0,,,320.0,
14_07_25 Torso A.txt,14_07_25,Torso A,Deadlifts,2.0,60.0,8.0,,,480.0,note increase weight next time
14_07_25 Torso A.txt,14_07_25,Torso A,Weighted Pull-Ups,1.0,,4.0,,,,
14_07_25 Torso A.txt,14_07_25,Torso A,Weighted Pull-Ups,2.0,,4.0,,,,with rest pause
14_07_25 Torso A.txt,14_07_25,Torso A,Chest Supported DB Rows,1.0,12.5,8.0,,,100.0,
14_07_25 Torso A.txt,14_07_25,Torso A,Chest Supported DB Rows,2.0,15.0,7.0,,,105.0,
14_07_25 Torso A.txt,14_07_25,Torso A,Shrugs,1.0,20.0,7.0,,,140.0,
14_07_25 Torso A.txt,14_07_25,Torso A,Shrugs,2.0,20.0,8.0,,,160.0,
14_07_25 Torso A.txt,14_07_25,Torso A,Front Wrist Curls,1.0,15.0,8.0,,,120.0,
14_07_25 Torso A.txt,14_07_25,Torso A,Front Wrist Curls,2.0,20.0,5.0,,,100.0,reduce weight with 2kg plate
14_07_25 Torso A.txt,14_07_25,Torso A,Reverse Wrist Curls,1.0,10.0,8.0,,,80.0,
14_07_25 Torso A.txt,14_07_25,Torso A,Reverse Wrist Curls,2.0,15.0,3.0,,,45.0,note reduce weight
14_08_25 Upper C.txt,14_08_25,Upper C,Lat Pulldown,1.0,50.0,8.0,,,400.0,f
14_08_25 Upper C.txt,14_08_25,Upper C,Lat Pulldown,2.0,50.0,6.0,,,300.0,f
14_08_25 Upper C.txt,14_08_25,Upper C,Incline Barbell Bench Press,1.0,46.0,12.0,,,552.0,f
14_08_25 Upper C.txt,14_08_25,Upper C,Incline Barbell Bench Press,2.0,50.0,7.0,,,350.0,f ; (Note: Form Wrong Butt have to stay in contact with bench)
14_08_25 Upper C.txt,14_08_25,Upper C,Seated Cable Rows,1.0,40.0,9.0,,,360.0,f
14_08_25 Upper C.txt,14_08_25,Upper C,Seated Cable Rows,2.0,40.0,8.0,,,320.0,f
14_08_25 Upper C.txt,14_08_25,Upper C,Dumbbell Lateral Raises,1.0,7.5,15.0,,,112.5,f
14_08_25 Upper C.txt,14_08_25,Upper C,Dumbbell Lateral Raises,2.0,7.5,15.0,,,112.5,"f, with rest pause"
14_08_25 Upper C.txt,14_08_25,Upper C,Incline Dumbbell Reverse Fly,1.0,4.0,15.0,,,60.0,
14_08_25 Upper C.txt,14_08_25,Upper C,Incline Dumbbell Reverse Fly,2.0,4.0,20.0,,,80.0,
14_08_25 Upper C.txt,14_08_25,Upper C,Dumbbell Preacher Curls,1.0,15.0,10.0,,,150.0,f
14_08_25 Upper C.txt,14_08_25,Upper C,Dumbbell Preacher Curls,2.0,15.0,9.0,,,135.0,f
14_08_25 Upper C.txt,14_08_25,Upper C,Weighted Triceps Dips,1.0,,9.0,,,,f
14_08_25 Upper C.txt,14_08_25,Upper C,Weighted Triceps Dips,2.0,,6.0,,,,f ; (Note: switch with declined Crunches Next time)
14_08_25 Upper C.txt,14_08_25,Upper C,Cable Crunches,1.0,30.0,15.0,,,450.0,lite feel
14_08_25 Upper C.txt,14_08_25,Upper C,Cable Crunches,2.0,40.0,10.0,,,400.0,same as before
15-10-25 Upper C.txt,2025-10-15,Upper C,Lat Pulldown,1.0,60.0,5.0,,,300.0,"f, without straps"
15-10-25 Upper C.txt,2025-10-15,Upper C,Lat Pulldown,2.0,60.0,4.0,,,240.0,"f, with straps"
15-10-25 Upper C.txt,2025-10-15,Upper C,Incline Barbell Bench Press,1.0,56.0,5.0,,,280.0,f
15-10-25 Upper C.txt,2025-10-15,Upper C,Incline Barbell Bench Press,2.0,56.0,6.0,,,336.0,f
15-10-25 Upper C.txt,2025-10-15,Upper C,Seated Cable Rows,1.0,50.0,5.0,,,250.0,f
15-10-25 Upper C.txt,2025-10-15,Upper C,Seated Cable Rows,2.0,50.0,4.0,,,200.0,f
15-10-25 Upper C.txt,2025-10-15,Upper C,Weighted Chin-Ups,1.0,,4.0,,,,f
15-10-25 Upper C.txt,2025-10-15,Upper C,Weighted Chin-Ups,2.0,,2.0,,,,f
15-10-25 Upper C.txt,2025-10-15,Upper C,Incline DB Lateral Raises,1.0,7.5,9.0,,,67.5,f
15-10-25 Upper C.txt,2025-10-15,Upper C,Incline DB Lateral Raises,2.0,7.5,8.0,,,60.0,f
15-10-25 Upper C.txt,2025-10-15,Upper C,Face Pulls,1.0,20.0,6.0,,,120.0,f
15-10-25 Upper C.txt,2025-10-15,Upper C,Face Pulls,2.0,20.0,5.0,,,100.0,f
15-10-25 Upper C.txt,2025-10-15,Upper C,Weighted Triceps Dips,1.0,5.0,4.0,,,20.0,f
15-10-25 Upper C.txt,2025-10-15,Upper C,Weighted Triceps Dips,2.0,5.0,4.0,,,20.0,f
15-10-25 Upper C.txt,2025-10-15,Upper C,Dumbbell Preacher Curls,1.0,20.0,7.0,,,140.0,f
15-10-25 Upper C.txt,2025-10-15,Upper C,Dumbbell Preacher Curls,2.0,20.0,6.0,,,120.0,f
15-10-25 Upper C.txt,2025-10-15,Upper C,Front Wrist Curls,1.0,25.0,11.0,,,275.0,f
15-10-25 Upper C.txt,2025-10-15,Upper C,Reverse Curls,1.0,20.0,8.0,,,160.0,f
15_07_25 Limb A.txt,15_07_25,Limb A,EZ Bar Bicep Curls,1.0,10.0,7.0,,,70.0,
15_07_25 Limb A.txt,15_07_25,Limb A,EZ Bar Bicep Curls,2.0,10.0,6.0,,,60.0,
15_07_25 Limb A.txt,15_07_25,Limb A,Cable Tricep Pushdowns,1.0,20.0,8.0,,,160.0,
15_07_25 Limb A.txt,15_07_25,Limb A,Cable Tricep Pushdowns,2.0,22.0,6.0,,,132.0,
15_07_25 Limb A.txt,15_07_25,Limb A,Dumbbell Hammer Curls,1.0,25.0,7.0,,,175.0,
15_07_25 Limb A.txt,15_07_25,Limb A,Dumbbell Hammer Curls,2.0,25.0,6.0,,,150.0,
15_07_25 Limb A.txt,15_07_25,Limb A,Overhead Cable Tricep Extension,1.0,22.0,6.0,,,132.0,
15_07_25 Limb A.txt,15_07_25,Limb A,Overhead Cable Tricep Extension,2.0,,22.0,,,,rest pause
15_07_25 Limb A.txt,15_07_25,Limb A,Barbell Back Squats,1.0,50.0,8.0,,,400.0,
15_07_25 Limb A.txt,15_07_25,Limb A,Barbell Back Squats,2.0,,60.0,,,,(note stick with 54kg)
15_07_25 Limb A.txt,15_07_25,Limb A,Bulgarian Split Squats,1.0,10.0,8.0,,,80.0,
15_07_25 Limb A.txt,15_07_25,Limb A,Bulgarian Split Squats,2.0,10.0,8.0,,,80.0,
15_07_25 Limb A.txt,15_07_25,Limb A,Lying Hamstring Curls,1.0,25.0,6.0,,,150.0,
15_07_25 Limb A.txt,15_07_25,Limb A,Lying Hamstring Curls,2.0,25.0,6.0,,,150.0,
15_07_25 Limb A.txt,15_07_25,Limb A,Leg Extension,1.0,30.0,7.0,,,210.0,
15_07_25 Limb A.txt,15_07_25,Limb A,Leg Extension,2.0,30.0,6.0,,,180.0,
15_07_25 Limb A.txt,15_07_25,Limb A,Seated Calf Raises,1.0,17.0,6.0,,,102.0,
15_07_25 Limb A.txt,15_07_25,Limb A,Seated Calf Raises,2.0,17.0,12.0,,,204.0,
15_07_25 Limb A.txt,15_07_25,Limb A,Standing Calf Raises,1.0,40.0,8.0,,,320.0,plate only
15_07_25 Limb A.txt,15_07_25,Limb A,Standing Calf Raises,2.0,40.0,12.0,,,480.0,(note add warmup set)
15_07_25 Limb A.txt,15_07_25,Limb A,Plank,1.0,5.0,,60.0,300.0,,felt it on core
15_07_25 Limb A.txt,15_07_25,Limb A,Plank,2.0,10.0,,45.0,450.0,,felt it core
15_07_25 Limb A.txt,15_07_25,Limb A,Elbow-Supported Leg Raises,1.0,,15.0,,,,
15_07_25 Limb A.txt,15_07_25,Limb A,Elbow-Supported Leg Raises,2.0,,13.0,,,,
16-09-25 Upper A.txt,2025-09-16,Upper A,Barbell Bench Press,1.0,62.0,7.0,,,434.0,f
16-09-25 Upper A.txt,2025-09-16,Upper A,Barbell Bench Press,2.0,62.0,5.0,,,310.0,f
16-09-25 Upper A.txt,2025-09-16,Upper A,Weighted Pull-Ups,1.0,5.0,5.0,,,25.0,f
16-09-25 Upper A.txt,2025-09-16,Upper A,Weighted Pull-Ups,2.0,,5.0,,,,f
16-09-25 Upper A.txt,2025-09-16,Upper A,Weighted Pull-Ups,3.0,5.0,3.0,,,15.0,f
16-09-25 Upper A.txt,2025-09-16,Upper A,Weighted Pull-Ups,4.0,5.0,2.0,,,10.0,f
16-09-25 Upper A.txt,2025-09-16,Upper A,Barbell Bent Over Rows,1.0,56.0,6.0,,,336.0,f
16-09-25 Upper A.txt,2025-09-16,Upper A,Barbell Bent Over Rows,2.0,56.0,8.0,,,448.0,"f, with straps"
16-09-25 Upper A.txt,2025-09-16,Upper A,Barbell Overhead Press,1.0,34.0,5.0,,,170.0,f
16-09-25 Upper A.txt,2025-09-16,Upper A,Barbell Overhead Press,2.0,34.0,8.0,,,272.0,f
16-09-25 Upper A.txt,2025-09-16,Upper A,Dumbbell Lateral Raises,1.0,7.5,19.0,,,142.5,f
16-09-25 Upper A.txt,2025-09-16,Upper A,Dumbbell Lateral Raises,2.0,7.5,16.0,,,120.0,f
16-09-25 Upper A.txt,2025-09-16,Upper A,Dumbbell Lateral Raises,3.0,7.5,14.0,,,105.0,f
16-09-25 Upper A.txt,2025-09-16,Upper A,Reverse Pec Deck,1.0,40.0,8.0,,,320.0,f
16-09-25 Upper A.txt,2025-09-16,Upper A,Reverse Pec Deck,2.0,40.0,6.0,,,240.0,f
16-09-25 Upper A.txt,2025-09-16,Upper A,Cable Bicep Curls,1.0,20.0,11.0,,,220.0,f
16-09-25 Upper A.txt,2025-09-16,Upper A,Cable Bicep Curls,2.0,20.0,10.0,,,200.0,f
16-09-25 Upper A.txt,2025-09-16,Upper A,Cable Bicep Curls,3.0,20.0,9.0,,,180.0,f ; (V - Bar)
16-09-25 Upper A.txt,2025-09-16,Upper A,Overhead Cable Tricep Extension,1.0,15.0,8.0,,,120.0,f
16-09-25 Upper A.txt,2025-09-16,Upper A,Overhead Cable Tricep Extension,2.0,15.0,5.0,,,75.0,f
16-09-25 Upper A.txt,2025-09-16,Upper A,Overhead Cable Tricep Extension,3.0,15.0,7.0,,,105.0,f
16-10-25 Lower D.txt,2025-10-16,Lower D,Deadlifts,1.0,100.0,8.0,,,800.0,"f, with belt, without straps, 4 reps alternative grip"
16-10-25 Lower D.txt,2025-10-16,Lower D,Deadlifts,2.0,110.0,4.0,,,440.0,"f, with straps and belt"
16-10-25 Lower D.txt,2025-10-16,Lower D,Barbell Good Mornings,1.0,34.0,10.0,,,340.0,f
16-10-25 Lower D.txt,2025-10-16,Lower D,Barbell Good Mornings,2.0,34.0,8.0,,,272.0,f
16-10-25 Lower D.txt,2025-10-16,Lower D,Bulgarian Split Squats,1.0,34.0,8.0,,,272.0,f
16-10-25 Lower D.txt,2025-10-16,Lower D,Bulgarian Split Squats,2.0,34.0,5.0,,,170.0,f
16-10-25 Lower D.txt,2025-10-16,Lower D,Shrugs,1.0,50.0,7.0,,,350.0,"f, without straps"
16-10-25 Lower D.txt,2025-10-16,Lower D,Shrugs,2.0,50.0,6.0,,,300.0,"f, without straps"
16-10-25 Lower D.txt,2025-10-16,Lower D,Seated Calf Raises,1.0,20.0,10.0,,,200.0,f
16-10-25 Lower D.txt,2025-10-16,Lower D,Seated Calf Raises,2.0,20.0,9.0,,,180.0,f
16-10-25 Lower D.txt,2025-10-16,Lower D,Side Plank,1.0,,,40.0,,,
16-10-25 Lower D.txt,2025-10-16,Lower D,Side Plank,2.0,,,30.0,,,
16-10-25 Lower D.txt,2025-10-16,Lower D,Decline Crunches,1.0,,8.0,,,,f
16-10-25 Lower D.txt,2025-10-16,Lower D,Decline Crunches,2.0,,6.0,,,,f
17-09-25 Lower  B.txt,2025-09-17,Lower  B,Barbell Back Squats,1.0,70.0,5.0,,,350.0,f
17-09-25 Lower  B.txt,2025-09-17,Lower  B,Barbell Back Squats,2.0,70.0,4.0,,,280.0,f ; (Reps drop from 7 reps)
17-09-25 Lower  B.txt,2025-09-17,Lower  B,Barbell RDLs,1.0,46.0,12.0,,,552.0,"f, mmc ok"
17-09-25 Lower  B.txt,2025-09-17,Lower  B,Barbell RDLs,2.0,46.0,12.0,,,552.0,"f, with straps"
17-09-25 Lower  B.txt,2025-09-17,Lower  B,Weighted Pull-Ups,1.0,,4.0,,,,ctf
17-09-25 Lower  B.txt,2025-09-17,Lower  B,Weighted Pull-Ups,2.0,,3.0,,,,ctf ; (Wide feet)
17-09-25 Lower  B.txt,2025-09-17,Lower  B,Leg Press,1.0,140.0,10.0,,,1400.0,ctf
17-09-25 Lower  B.txt,2025-09-17,Lower  B,Leg Press,2.0,140.0,9.0,,,1260.0,f ; (Dropped weight from 150 to 140)
17-09-25 Lower  B.txt,2025-09-17,Lower  B,Lying Hamstring Curls,1.0,20.0,6.0,,,120.0,f
17-09-25 Lower  B.txt,2025-09-17,Lower  B,Lying Hamstring Curls,2.0,20.0,7.0,,,140.0,f
17-09-25 Lower  B.txt,2025-09-17,Lower  B,Seated Calf Raises,1.0,15.0,15.0,,,225.0,f
17-09-25 Lower  B.txt,2025-09-17,Lower  B,Seated Calf Raises,2.0,15.0,12.0,,,180.0,f
17-09-25 Lower  B.txt,2025-09-17,Lower  B,Plank,1.0,15.0,,60.0,900.0,,f
17-09-25 Lower  B.txt,2025-09-17,Lower  B,Plank,2.0,15.0,,40.0,600.0,,f
17-09-25 Lower  B.txt,2025-09-17,Lower  B,Elbow-Supported Leg Raises,1.0,,17.0,,,,f
17-09-25 Lower  B.txt,2025-09-17,Lower  B,Elbow-Supported Leg Raises,2.0,,14.0,,,,f
17-10-25 Sharms.txt,2025-10-17,Sharms,Seated Dumbbell Press,1.0,20.0,4.0,,,80.0,f
17-10-25 Sharms.txt,2025-10-17,Sharms,Seated Dumbbell Press,2.0,20.0,5.0,,,100.0,f
17-10-25 Sharms.txt,2025-10-17,Sharms,Seated Dumbbell Press,3.0,,20.0,,,,f
17-10-25 Sharms.txt,2025-10-17,Sharms,Cable Lateral Raises,1.0,10.0,7.0,,,70.0,f
17-10-25 Sharms.txt,2025-10-17,Sharms,Cable Lateral Raises,2.0,10.0,5.0,,,50.0,f
17-10-25 Sharms.txt,2025-10-17,Sharms,Cable Lateral Raises,3.0,10.0,4.0,,,40.0,f
17-10-25 Sharms.txt,2025-10-17,Sharms,Reverse Pec Deck,1.0,30.0,13.0,,,390.0,f
17-10-25 Sharms.txt,2025-10-17,Sharms,Reverse Pec Deck,2.0,30.0,10.0,,,300.0,f
17-10-25 Sharms.txt,2025-10-17,Sharms,Reverse Pec Deck,3.0,30.0,8.0,,,240.0,f ; (V - Bar)
17-10-25 Sharms.txt,2025-10-17,Sharms,Cable Tricep Pushdowns,1.0,25.0,9.0,,,225.0,f
17-10-25 Sharms.txt,2025-10-17,Sharms,Cable Tricep Pushdowns,2.0,25.0,7.0,,,175.0,f
17-10-25 Sharms.txt,2025-10-17,Sharms,Cable Tricep Pushdowns,3.0,20.0,12.0,,,240.0,f
17-10-25 Sharms.txt,2025-10-17,Sharms,EZ Bar Spider Curls,1.0,,26.0,,,,f
17-10-25 Sharms.txt,2025-10-17,Sharms,EZ Bar Spider Curls,2.0,26.0,7.0,,,182.0,f
17-10-25 Sharms.txt,2025-10-17,Sharms,EZ Bar Spider Curls,3.0,20.0,15.0,,,300.0,f
17-10-25 Sharms.txt,2025-10-17,Sharms,Cable Tricep Kickbacks,1.0,10.0,6.0,,,60.0,f
17-10-25 Sharms.txt,2025-10-17,Sharms,Cable Tricep Kickbacks,2.0,10.0,4.0,,,40.0,f
17-10-25 Sharms.txt,2025-10-17,Sharms,Cable Tricep Kickbacks,3.0,,,,,,skipped
17-10-25 Sharms.txt,2025-10-17,Sharms,Cable Hammer Curls,1.0,25.0,6.0,,,150.0,f
17-10-25 Sharms.txt,2025-10-17,Sharms,Cable Hammer Curls,2.0,25.0,5.0,,,125.0,f
17-10-25 Sharms.txt,2025-10-17,Sharms,Cable Hammer Curls,3.0,20.0,10.0,,,200.0,f
17-10-25 Sharms.txt,2025-10-17,Sharms,Front Wrist Curls,1.0,7.5,15.0,,,112.5,
17-10-25 Sharms.txt,2025-10-17,Sharms,Front Wrist Curls,2.0,7.5,15.0,,,112.5,
17-10-25 Sharms.txt,2025-10-17,Sharms,Reverse Wrist Curls,1.0,5.0,10.0,,,50.0,
17-10-25 Sharms.txt,2025-10-17,Sharms,Reverse Wrist Curls,2.0,5.0,10.0,,,50.0,
17-10-25 Sharms.txt,2025-10-17,Sharms,Farmer Carry,1.0,,,,,,Kg ×   Sec
17-10-25 Sharms.txt,2025-10-17,Sharms,Farmer Carry,2.0,,,,,,Kg ×   Sec
17_07_25 Torso B.txt,2025-07-17,Torso B,Lat Pulldown,1.0,,40.0,,,,
17_07_25 Torso B.txt,2025-07-17,Torso B,Lat Pulldown,2.0,45.0,7.0,,,315.0,failure
17_07_25 Torso B.txt,2025-07-17,Torso B,Lat Pulldown,3.0,45.0,6.0,,,270.0,failure
17_07_25 Torso B.txt,2025-07-17,Torso B,T-Bar Rows,1.0,40.0,6.0,,,240.0,
17_07_25 Torso B.txt,2025-07-17,Torso B,T-Bar Rows,2.0,40.0,6.0,,,240.0,
17_07_25 Torso B.txt,2025-07-17,Torso B,Reverse Pec Deck,1.0,40.0,6.0,,,240.0,
17_07_25 Torso B.txt,2025-07-17,Torso B,Reverse Pec Deck,2.0,40.0,5.0,,,200.0,
17_07_25 Torso B.txt,2025-07-17,Torso B,Seated Barbell Press,1.0,24.0,8.0,,,192.0,Close to failure
17_07_25 Torso B.txt,2025-07-17,Torso B,Seated Barbell Press,2.0,26.0,7.0,,,182.0,failure
17_07_25 Torso B.txt,2025-07-17,Torso B,Dumbbell Lateral Raises,1.0,7.5,12.0,,,90.0,
17_07_25 Torso B.txt,2025-07-17,Torso B,Dumbbell Lateral Raises,2.0,7.5,10.0,,,75.0,
17_07_25 Torso B.txt,2025-07-17,Torso B,Shrugs,1.0,20.0,9.0,,,180.0,
17_07_25 Torso B.txt,2025-07-17,Torso B,Shrugs,2.0,20.0,8.0,,,160.0,
17_07_25 Torso B.txt,2025-07-17,Torso B,DB Incline Press,1.0,20.0,7.0,,,140.0,
17_07_25 Torso B.txt,2025-07-17,Torso B,DB Incline Press,2.0,20.0,6.0,,,120.0,
17_07_25 Torso B.txt,2025-07-17,Torso B,Chest Pec Deck,1.0,45.0,7.0,,,315.0,
17_07_25 Torso B.txt,2025-07-17,Torso B,Chest Pec Deck,2.0,45.0,6.0,,,270.0,
17_07_25 Torso B.txt,2025-07-17,Torso B,Finger Push-Ups,1.0,,2.0,,,,
18-09-25 Upper C.txt,2025-09-18,Upper C,Lat Pulldown,1.0,55.0,5.0,,,275.0,"f, no straps"
18-09-25 Upper C.txt,2025-09-18,Upper C,Lat Pulldown,2.0,55.0,6.0,,,330.0,"f, with straps"
18-09-25 Upper C.txt,2025-09-18,Upper C,Lat Pulldown,3.0,55.0,5.0,,,275.0,"f, with straps"
18-09-25 Upper C.txt,2025-09-18,Upper C,Incline Barbell Bench Press,1.0,52.0,7.0,,,364.0,f
18-09-25 Upper C.txt,2025-09-18,Upper C,Incline Barbell Bench Press,2.0,52.0,7.0,,,364.0,"f, with last 1 assistance"
18-09-25 Upper C.txt,2025-09-18,Upper C,Seated Cable Rows,1.0,45.0,8.0,,,360.0,f
18-09-25 Upper C.txt,2025-09-18,Upper C,Seated Cable Rows,2.0,45.0,6.0,,,270.0,f
18-09-25 Upper C.txt,2025-09-18,Upper C,Dumbbell Lateral Raises,1.0,7.5,20.0,,,150.0,f
18-09-25 Upper C.txt,2025-09-18,Upper C,Dumbbell Lateral Raises,2.0,7.5,17.0,,,127.5,f
18-09-25 Upper C.txt,2025-09-18,Upper C,Dumbbell Lateral Raises,3.0,7.5,15.0,,,112.5,f
18-09-25 Upper C.txt,2025-09-18,Upper C,Face Pulls,1.0,20.0,10.0,,,200.0,f
18-09-25 Upper C.txt,2025-09-18,Upper C,Face Pulls,2.0,20.0,8.0,,,160.0,f
18-09-25 Upper C.txt,2025-09-18,Upper C,Face Pulls,3.0,20.0,9.0,,,180.0,f
18-09-25 Upper C.txt,2025-09-18,Upper C,Dumbbell Preacher Curls,1.0,20.0,7.0,,,140.0,f
18-09-25 Upper C.txt,2025-09-18,Upper C,Dumbbell Preacher Curls,2.0,20.0,5.0,,,100.0,f
18-09-25 Upper C.txt,2025-09-18,Upper C,Dumbbell Preacher Curls,3.0,20.0,4.0,,,80.0,f
18-09-25 Upper C.txt,2025-09-18,Upper C,Weighted Triceps Dips,1.0,5.0,6.0,,,30.0,f
18-09-25 Upper C.txt,2025-09-18,Upper C,Weighted Triceps Dips,2.0,5.0,4.0,,,20.0,f
18-09-25 Upper C.txt,2025-09-18,Upper C,Weighted Triceps Dips,3.0,,5.0,,,,f
18_08_25 Lower D.txt,18_08_25,Lower D,Deadlifts,1.0,100.0,6.0,,,600.0,"f, mixed grip without belt"
18_08_25 Lower D.txt,18_08_25,Lower D,Deadlifts,2.0,100.0,5.0,,,500.0,same as before ; (learning)
18_08_25 Lower D.txt,18_08_25,Lower D,Front Barbell Squats,1.0,,20.0,,,,
18_08_25 Lower D.txt,18_08_25,Lower D,Front Barbell Squats,2.0,,,,,,"same as before ; (back of the foot ket raising while sitting down, controlled as much as possible) ; (Curls as machine was faulty last time done this)"
18_08_25 Lower D.txt,18_08_25,Lower D,Bulgarian Split Squats,1.0,,10.0,,,,
18_08_25 Lower D.txt,18_08_25,Lower D,Bulgarian Split Squats,2.0,20.0,12.0,,,240.0,"f, good MMC"
18_08_25 Lower D.txt,18_08_25,Lower D,Shrugs,1.0,20.0,12.0,,,240.0,f
18_08_25 Lower D.txt,18_08_25,Lower D,Shrugs,2.0,20.0,10.0,,,200.0,f
18_08_25 Lower D.txt,18_08_25,Lower D,Seated Calf Raises,1.0,15.0,12.0,,,180.0,f
18_08_25 Lower D.txt,18_08_25,Lower D,Seated Calf Raises,2.0,15.0,11.0,,,165.0,f
18_08_25 Lower D.txt,18_08_25,Lower D,Reverse EZ Bar Curls,1.0,26.0,9.0,,,234.0,f
18_08_25 Lower D.txt,18_08_25,Lower D,Reverse EZ Bar Curls,2.0,26.0,7.0,,,182.0,f
18_08_25 Lower D.txt,18_08_25,Lower D,Cable Tricep Pushdowns,1.0,20.0,8.0,,,160.0,"f, last 2 not perfect form"
18_08_25 Lower D.txt,18_08_25,Lower D,Cable Tricep Pushdowns,2.0,20.0,8.0,,,160.0,"f, rest pause"
18_08_25 Lower D.txt,18_08_25,Lower D,Front Wrist Curls,1.0,15.0,10.0,,,150.0,f
18_08_25 Lower D.txt,18_08_25,Lower D,Front Wrist Curls,2.0,15.0,8.0,,,120.0,f
18_08_25 Lower D.txt,18_08_25,Lower D,Side Plank,1.0,,,50.0,,,f
18_08_25 Lower D.txt,18_08_25,Lower D,Side Plank,2.0,,,45.0,,,f ; Weight: 70kg
19-11-25 Full Body.txt,2025-11-19,Full Body,Deadlifts,1.0,120.0,4.0,,,480.0,2 without straps
19-11-25 Full Body.txt,2025-11-19,Full Body,Deadlifts,2.0,120.0,3.0,,,360.0,"with straps and belt, f"
19-11-25 Full Body.txt,2025-11-19,Full Body,Barbell Bench Press,1.0,70.0,3.0,,,210.0,"f, PR"
19-11-25 Full Body.txt,2025-11-19,Full Body,Barbell Bench Press,2.0,70.0,2.0,,,140.0,"f, PR"
19-11-25 Full Body.txt,2025-11-19,Full Body,Barbell Back Squats,1.0,80.0,4.0,,,320.0,"last 2 form off, f"
19-11-25 Full Body.txt,2025-11-19,Full Body,Barbell Back Squats,2.0,70.0,2.0,,,140.0,f
19-11-25 Full Body.txt,2025-11-19,Full Body,Lat Pulldown,1.0,70.0,4.0,,,280.0,"f, 2 without straps"
19-11-25 Full Body.txt,2025-11-19,Full Body,Lat Pulldown,2.0,70.0,2.0,,,140.0,f
19-11-25 Full Body.txt,2025-11-19,Full Body,Barbell Overhead Press,1.0,40.0,8.0,,,320.0,f
19-11-25 Full Body.txt,2025-11-19,Full Body,Barbell Overhead Press,2.0,40.0,4.0,,,160.0,f
19-11-25 Full Body.txt,2025-11-19,Full Body,Barbell Bent Over Rows,1.0,60.0,6.0,,,360.0,f
19-11-25 Full Body.txt,2025-11-19,Full Body,Overhead Cable Tricep Extension,1.0,,25.0,,,,f
19-11-25 Full Body.txt,2025-11-19,Full Body,Cable Bicep Curls,1.0,,30.0,,,,f
19-11-25 Full Body.txt,2025-11-19,Full Body,Seated Calf Raises,1.0,,20.0,,,,f
19_08_25 Upper A.txt,19_08_25,Upper A,Barbell Bench Press,1.0,64.0,5.0,,,320.0,f
19_08_25 Upper A.txt,19_08_25,Upper A,Barbell Bench Press,2.0,64.0,4.0,,,256.0,f
19_08_25 Upper A.txt,19_08_25,Upper A,Barbell Bench Press,3.0,54.0,7.0,,,378.0,f ; (Note: stick with this weight until easy as form is not perfect)
19_08_25 Upper A.txt,19_08_25,Upper A,Barbell Bent Over Rows,1.0,54.0,6.0,,,324.0,f
19_08_25 Upper A.txt,19_08_25,Upper A,Barbell Bent Over Rows,2.0,54.0,4.0,,,216.0,f
19_08_25 Upper A.txt,19_08_25,Upper A,Weighted Pull-Ups,1.0,,5.0,,,,"f, with rest pause"
19_08_25 Upper A.txt,19_08_25,Upper A,Weighted Pull-Ups,2.0,,4.0,,,,"f, rest pause"
19_08_25 Upper A.txt,19_08_25,Upper A,Barbell Overhead Press,1.0,40.0,6.0,,,240.0,f
19_08_25 Upper A.txt,19_08_25,Upper A,Barbell Overhead Press,2.0,40.0,5.0,,,200.0,f
19_08_25 Upper A.txt,19_08_25,Upper A,Incline Dumbbell Press,1.0,20.0,9.0,,,180.0,f
19_08_25 Upper A.txt,19_08_25,Upper A,Incline Dumbbell Press,2.0,20.0,6.0,,,120.0,f
19_08_25 Upper A.txt,19_08_25,Upper A,Dumbbell Lateral Raises,1.0,7.5,15.0,,,112.5,"f, after 10-12 not good form"
19_08_25 Upper A.txt,19_08_25,Upper A,Dumbbell Lateral Raises,2.0,7.5,15.0,,,112.5,"f, rest pause"
19_08_25 Upper A.txt,19_08_25,Upper A,Barbell Bicep Curls,1.0,30.0,8.0,,,240.0,f
19_08_25 Upper A.txt,19_08_25,Upper A,Barbell Bicep Curls,2.0,30.0,7.0,,,210.0,f
19_08_25 Upper A.txt,19_08_25,Upper A,Overhead Cable Tricep Extension,1.0,15.0,10.0,,,150.0,f
19_08_25 Upper A.txt,19_08_25,Upper A,Overhead Cable Tricep Extension,2.0,17.0,7.0,,,119.0,f
19_08_25 Upper A.txt,19_08_25,Upper A,Reverse Pec Deck,1.0,40.0,8.0,,,320.0,f
19_08_25 Upper A.txt,19_08_25,Upper A,Reverse Pec Deck,2.0,40.0,7.0,,,280.0,f
19_08_25 Upper A.txt,19_08_25,Upper A,Hanging Knee Raises,1.0,,15.0,,,,
19_08_25 Upper A.txt,19_08_25,Upper A,Hanging Knee Raises,2.0,,15.0,,,,
20-09-25 Lower D.txt,2025-09-20,Lower D,Deadlifts,1.0,110.0,7.0,,,770.0,"f, with straps and belt, last form broke"
20-09-25 Lower D.txt,2025-09-20,Lower D,Deadlifts,2.0,110.0,4.0,,,440.0,"f, with straps and belt"
20-09-25 Lower D.txt,2025-09-20,Lower D,Weighted Pull-Ups,1.0,,4.0,,,,f
20-09-25 Lower D.txt,2025-09-20,Lower D,Weighted Pull-Ups,2.0,,2.0,,,,f
20-09-25 Lower D.txt,2025-09-20,Lower D,Weighted Pull-Ups,3.0,,2.0,,,,f
20-09-25 Lower D.txt,2025-09-20,Lower D,Weighted Pull-Ups,4.0,,4.0,,,,"f, with straps"
20-09-25 Lower D.txt,2025-09-20,Lower D,Barbell Good Mornings,1.0,30.0,12.0,,,360.0,ctf
20-09-25 Lower D.txt,2025-09-20,Lower D,Barbell Good Mornings,2.0,30.0,12.0,,,360.0,ctf
20-09-25 Lower D.txt,2025-09-20,Lower D,Bulgarian Split Squats,1.0,30.0,8.0,,,240.0,f
20-09-25 Lower D.txt,2025-09-20,Lower D,Bulgarian Split Squats,2.0,30.0,8.0,,,240.0,f
20-09-25 Lower D.txt,2025-09-20,Lower D,Shrugs,1.0,50.0,5.0,,,250.0,f
20-09-25 Lower D.txt,2025-09-20,Lower D,Shrugs,2.0,50.0,8.0,,,400.0,"f, with straps"
20-09-25 Lower D.txt,2025-09-20,Lower D,Seated Calf Raises,1.0,20.0,6.0,,,120.0,f
20-09-25 Lower D.txt,2025-09-20,Lower D,Seated Calf Raises,2.0,20.0,5.0,,,100.0,f
20-09-25 Lower D.txt,2025-09-20,Lower D,Side Plank,1.0,,,37.0,,,f
20-09-25 Lower D.txt,2025-09-20,Lower D,Side Plank,2.0,,,30.0,,,
20-09-25 Lower D.txt,2025-09-20,Lower D,Decline Crunches,1.0,,13.0,,,,f
20-09-25 Lower D.txt,2025-09-20,Lower D,Decline Crunches,2.0,,6.0,,,,f
20_08_25 Lower  B.txt,20_08_25,Lower  B,Barbell Back Squats,1.0,72.0,4.0,,,288.0,f
20_08_25 Lower  B.txt,20_08_25,Lower  B,Barbell Back Squats,2.0,72.0,2.0,,,144.0,f
20_08_25 Lower  B.txt,20_08_25,Lower  B,Barbell Back Squats,3.0,50.0,10.0,,,500.0,cardio failure
20_08_25 Lower  B.txt,20_08_25,Lower  B,Dumbbell RDLs,1.0,20.0,8.0,,,160.0,ctf
20_08_25 Lower  B.txt,20_08_25,Lower  B,Dumbbell RDLs,2.0,20.0,9.0,,,180.0,"f, grip ; (wide feet)"
20_08_25 Lower  B.txt,20_08_25,Lower  B,Leg Press,1.0,150.0,9.0,,,1350.0,"f, last 2 not perfectly down"
20_08_25 Lower  B.txt,20_08_25,Lower  B,Leg Press,2.0,150.0,7.0,,,1050.0,f
20_08_25 Lower  B.txt,20_08_25,Lower  B,Lying Hamstring Curls,1.0,20.0,8.0,,,160.0,f
20_08_25 Lower  B.txt,20_08_25,Lower  B,Lying Hamstring Curls,2.0,20.0,6.0,,,120.0,f
20_08_25 Lower  B.txt,20_08_25,Lower  B,Seated Calf Raises,1.0,15.0,14.0,,,210.0,f
20_08_25 Lower  B.txt,20_08_25,Lower  B,Seated Calf Raises,2.0,15.0,12.0,,,180.0,f
20_08_25 Lower  B.txt,20_08_25,Lower  B,Cable Tricep Kickbacks,1.0,5.0,11.0,,,55.0,f
20_08_25 Lower  B.txt,20_08_25,Lower  B,Cable Tricep Kickbacks,2.0,5.0,9.0,,,45.0,f
20_08_25 Lower  B.txt,20_08_25,Lower  B,Dumbbell Hammer Curls,1.0,12.5,8.0,,,100.0,f
20_08_25 Lower  B.txt,20_08_25,Lower  B,Dumbbell Hammer Curls,2.0,12.5,6.0,,,75.0,f
20_08_25 Lower  B.txt,20_08_25,Lower  B,Plank,1.0,15.0,,36.0,540.0,,
20_08_25 Lower  B.txt,20_08_25,Lower  B,Plank,2.0,15.0,,55.0,825.0,,f
21_07_25 Torso A.txt,21_07_25,Torso A,Weighted Pull-Ups,1.0,,5.0,,,,Close to failure
21_07_25 Torso A.txt,21_07_25,Torso A,Weighted Pull-Ups,2.0,,4.0,,,,failure
21_07_25 Torso A.txt,21_07_25,Torso A,Weighted Pull-Ups,3.0,,2.0,,,,failure
21_07_25 Torso A.txt,21_07_25,Torso A,Seated Cable Rows,1.0,35.0,8.0,,,280.0,Close
21_07_25 Torso A.txt,21_07_25,Torso A,Seated Cable Rows,2.0,40.0,7.0,,,280.0,failure
21_07_25 Torso A.txt,21_07_25,Torso A,Cable Lateral Raises,1.0,5.0,10.0,,,50.0,failure
21_07_25 Torso A.txt,21_07_25,Torso A,Cable Lateral Raises,2.0,5.0,7.0,,,35.0,failure
21_07_25 Torso A.txt,21_07_25,Torso A,Reverse Pec Deck,1.0,35.0,7.0,,,245.0,failure
21_07_25 Torso A.txt,21_07_25,Torso A,Reverse Pec Deck,2.0,35.0,6.0,,,210.0,failure
21_07_25 Torso A.txt,21_07_25,Torso A,Incline Dumbbell Press,1.0,20.0,7.0,,,140.0,close
21_07_25 Torso A.txt,21_07_25,Torso A,Incline Dumbbell Press,2.0,20.0,6.0,,,120.0,failure
21_07_25 Torso A.txt,21_07_25,Torso A,Face Pulls,1.0,25.0,8.0,,,200.0,failure
21_07_25 Torso A.txt,21_07_25,Torso A,Face Pulls,2.0,25.0,6.0,,,150.0,failure
21_07_25 Torso A.txt,21_07_25,Torso A,Front Wrist Curls,1.0,17.0,8.0,,,136.0,
21_07_25 Torso A.txt,21_07_25,Torso A,Front Wrist Curls,2.0,20.0,6.0,,,120.0,
21_07_25 Torso A.txt,21_07_25,Torso A,Push-Ups,1.0,,13.0,,,,failure
21_07_25 Torso A.txt,21_07_25,Torso A,Push-Ups,2.0,,10.0,,,,failure
22-09-25 Upper A.txt,2025-09-22,Upper A,Barbell Bench Press,1.0,50.0,8.0,,,400.0,1-2 RIR
22-09-25 Upper A.txt,2025-09-22,Upper A,Barbell Bench Press,2.0,50.0,5.0,,,250.0,1 RIP
22-09-25 Upper A.txt,2025-09-22,Upper A,Barbell Bench Press,3.0,50.0,10.0,,,500.0,f
22-09-25 Upper A.txt,2025-09-22,Upper A,Weighted Pull-Ups,1.0,5.0,3.0,,,15.0,ctf
22-09-25 Upper A.txt,2025-09-22,Upper A,Weighted Pull-Ups,2.0,5.0,2.0,,,10.0,f
22-09-25 Upper A.txt,2025-09-22,Upper A,Weighted Pull-Ups,3.0,,3.0,,,,f
22-09-25 Upper A.txt,2025-09-22,Upper A,Weighted Pull-Ups,4.0,,2.0,,,,f
22-09-25 Upper A.txt,2025-09-22,Upper A,Barbell Bent Over Rows,1.0,40.0,7.0,,,280.0,1-2 RIR
22-09-25 Upper A.txt,2025-09-22,Upper A,Barbell Bent Over Rows,2.0,40.0,5.0,,,200.0,1-2 RIR
22-09-25 Upper A.txt,2025-09-22,Upper A,Barbell Overhead Press,1.0,30.0,6.0,,,180.0,1-2 RIR
22-09-25 Upper A.txt,2025-09-22,Upper A,Barbell Overhead Press,2.0,30.0,5.0,,,150.0,f
22-09-25 Upper A.txt,2025-09-22,Upper A,Incline Dumbbell Press,1.0,20.0,8.0,,,160.0,1 RIR
22-09-25 Upper A.txt,2025-09-22,Upper A,Incline Dumbbell Press,2.0,20.0,7.0,,,140.0,f
22-09-25 Upper A.txt,2025-09-22,Upper A,Dumbbell Lateral Raises,1.0,7.5,15.0,,,112.5,
22-09-25 Upper A.txt,2025-09-22,Upper A,Dumbbell Lateral Raises,2.0,7.5,15.0,,,112.5,
22-09-25 Upper A.txt,2025-09-22,Upper A,Dumbbell Lateral Raises,3.0,7.5,15.0,,,112.5,f
22-09-25 Upper A.txt,2025-09-22,Upper A,Reverse Pec Deck,1.0,30.0,15.0,,,450.0,
22-09-25 Upper A.txt,2025-09-22,Upper A,Reverse Pec Deck,2.0,30.0,12.0,,,360.0,
22-09-25 Upper A.txt,2025-09-22,Upper A,Reverse Pec Deck,3.0,15.0,11.0,,,165.0,single arm
22-09-25 Upper A.txt,2025-09-22,Upper A,Cable Bicep Curls,1.0,21.0,11.0,,,231.0,f
22-09-25 Upper A.txt,2025-09-22,Upper A,Cable Bicep Curls,2.0,21.0,10.0,,,210.0,f
22-09-25 Upper A.txt,2025-09-22,Upper A,Cable Bicep Curls,3.0,21.0,9.0,,,189.0,f ; (V - Bar)
22-09-25 Upper A.txt,2025-09-22,Upper A,Overhead Cable Tricep Extension,1.0,15.0,7.0,,,105.0,f
22-09-25 Upper A.txt,2025-09-22,Upper A,Overhead Cable Tricep Extension,2.0,15.0,6.0,,,90.0,f
22-09-25 Upper A.txt,2025-09-22,Upper A,Overhead Cable Tricep Extension,3.0,15.0,6.0,,,90.0,f
22-10-25 Upper A.txt,2025-10-22,Upper A,Barbell Bench Press,1.0,64.0,7.0,,,448.0,f
22-10-25 Upper A.txt,2025-10-22,Upper A,Barbell Bench Press,2.0,64.0,5.0,,,320.0,f
22-10-25 Upper A.txt,2025-10-22,Upper A,Barbell Bench Press,3.0,50.0,10.0,,,500.0,f
22-10-25 Upper A.txt,2025-10-22,Upper A,Weighted Pull-Ups,1.0,5.0,4.0,,,20.0,f
22-10-25 Upper A.txt,2025-10-22,Upper A,Weighted Pull-Ups,2.0,5.0,2.0,,,10.0,f
22-10-25 Upper A.txt,2025-10-22,Upper A,Weighted Pull-Ups,3.0,,2.0,,,,f
22-10-25 Upper A.txt,2025-10-22,Upper A,Lat Pulldown,1.0,50.0,7.0,,,350.0,f
22-10-25 Upper A.txt,2025-10-22,Upper A,Lat Pulldown,2.0,50.0,5.0,,,250.0,f
22-10-25 Upper A.txt,2025-10-22,Upper A,Barbell Overhead Press,1.0,40.0,6.0,,,240.0,f
22-10-25 Upper A.txt,2025-10-22,Upper A,Barbell Overhead Press,2.0,40.0,4.0,,,160.0,
22-10-25 Upper A.txt,2025-10-22,Upper A,Barbell Overhead Press,,30.0,5.0,,,150.0,
22-10-25 Upper A.txt,2025-10-22,Upper A,Barbell Bent Over Rows,1.0,60.0,9.0,,,540.0,"f, 6 reps without straps"
22-10-25 Upper A.txt,2025-10-22,Upper A,Barbell Bent Over Rows,2.0,60.0,7.0,,,420.0,"f, with straps"
22-10-25 Upper A.txt,2025-10-22,Upper A,Incline DB Lateral Raises,1.0,7.5,12.0,,,90.0,f
22-10-25 Upper A.txt,2025-10-22,Upper A,Incline DB Lateral Raises,2.0,7.5,10.0,,,75.0,f
22-10-25 Upper A.txt,2025-10-22,Upper A,Incline DB Lateral Raises,3.0,7.5,7.0,,,52.5,f
22-10-25 Upper A.txt,2025-10-22,Upper A,1-Arm Reverse Pec Deck,1.0,25.0,8.0,,,200.0,f
22-10-25 Upper A.txt,2025-10-22,Upper A,1-Arm Reverse Pec Deck,2.0,25.0,7.0,,,175.0,f ; (V - Bar)
22-10-25 Upper A.txt,2025-10-22,Upper A,Overhead Cable Tricep Extension,1.0,16.0,7.0,,,112.0,f
22-10-25 Upper A.txt,2025-10-22,Upper A,Overhead Cable Tricep Extension,2.0,16.0,7.0,,,112.0,f
22-10-25 Upper A.txt,2025-10-22,Upper A,Overhead Cable Tricep Extension,3.0,10.0,15.0,,,150.0,
22-10-25 Upper A.txt,2025-10-22,Upper A,Cable Bicep Curls,1.0,30.0,5.0,,,150.0,f
22-10-25 Upper A.txt,2025-10-22,Upper A,Cable Bicep Curls,2.0,30.0,4.0,,,120.0,f ; (Cable)
22-10-25 Upper A.txt,2025-10-22,Upper A,Front Wrist Curls,1.0,15.0,20.0,,,300.0,f
22-10-25 Upper A.txt,2025-10-22,Upper A,Front Wrist Curls,2.0,15.0,21.0,,,315.0,f ; (Current BW Weight: 74.46 kg) ; (4 KG increase from last month)
22_07_25 Limbs A.txt,22_07_25,Limbs A,Deadlifts,1.0,90.0,6.0,,,540.0,failure i think
22_07_25 Limbs A.txt,22_07_25,Limbs A,Deadlifts,2.0,90.0,6.0,,,540.0,form broke at 5 ; (Plate weight only)
22_07_25 Limbs A.txt,22_07_25,Limbs A,EZ Bar Skull Crushers,1.0,20.0,7.0,,,140.0,failure
22_07_25 Limbs A.txt,22_07_25,Limbs A,EZ Bar Skull Crushers,2.0,20.0,6.0,,,120.0,f
22_07_25 Limbs A.txt,22_07_25,Limbs A,EZ Bar Bicep Curls,1.0,20.0,8.0,,,160.0,failure
22_07_25 Limbs A.txt,22_07_25,Limbs A,EZ Bar Bicep Curls,2.0,24.0,6.0,,,144.0,f
22_07_25 Limbs A.txt,22_07_25,Limbs A,Hack Squat,1.0,70.0,9.0,,,630.0,f
22_07_25 Limbs A.txt,22_07_25,Limbs A,Hack Squat,2.0,90.0,8.0,,,720.0,f ; (Note this Machine is easy switch workout next time for BSS)
22_07_25 Limbs A.txt,22_07_25,Limbs A,Leg Extension,1.0,30.0,8.0,,,240.0,
22_07_25 Limbs A.txt,22_07_25,Limbs A,Leg Extension,2.0,30.0,11.0,,,330.0,(Note increase weight)
22_07_25 Limbs A.txt,22_07_25,Limbs A,Seated Calf Raises,1.0,20.0,9.0,,,180.0,failure i think
22_07_25 Limbs A.txt,22_07_25,Limbs A,Seated Calf Raises,2.0,20.0,8.0,,,160.0,not failure
22_07_25 Limbs A.txt,22_07_25,Limbs A,Plank,1.0,10.0,,60.0,600.0,,
22_07_25 Limbs A.txt,22_07_25,Limbs A,Hanging Knee Raises,1.0,,14.0,,,,
22_08_25 Upper C.txt,22_08_25,Upper C,Lat Pulldown,1.0,55.0,6.0,,,330.0,f
22_08_25 Upper C.txt,22_08_25,Upper C,Lat Pulldown,2.0,55.0,5.0,,,275.0,f
22_08_25 Upper C.txt,22_08_25,Upper C,Lat Pulldown,3.0,,45.0,,,,f
22_08_25 Upper C.txt,22_08_25,Upper C,Incline Barbell Bench Press,1.0,50.0,9.0,,,450.0,ctf
22_08_25 Upper C.txt,22_08_25,Upper C,Incline Barbell Bench Press,2.0,50.0,7.0,,,350.0,ctf
22_08_25 Upper C.txt,22_08_25,Upper C,Seated Cable Rows,1.0,40.0,10.0,,,400.0,f
22_08_25 Upper C.txt,22_08_25,Upper C,Seated Cable Rows,2.0,40.0,8.0,,,320.0,f
22_08_25 Upper C.txt,22_08_25,Upper C,Dumbbell Lateral Raises,1.0,7.5,16.0,,,120.0,f
22_08_25 Upper C.txt,22_08_25,Upper C,Dumbbell Lateral Raises,2.0,7.5,14.0,,,105.0,f
22_08_25 Upper C.txt,22_08_25,Upper C,Incline Dumbbell Reverse Fly,1.0,5.0,20.0,,,100.0,
22_08_25 Upper C.txt,22_08_25,Upper C,Incline Dumbbell Reverse Fly,2.0,5.0,20.0,,,100.0,
22_08_25 Upper C.txt,22_08_25,Upper C,Dumbbell Preacher Curls,1.0,15.0,10.0,,,150.0,"f, cn"
22_08_25 Upper C.txt,22_08_25,Upper C,Dumbbell Preacher Curls,2.0,15.0,8.0,,,120.0,"f, cn"
22_08_25 Upper C.txt,22_08_25,Upper C,Weighted Triceps Dips,1.0,,10.0,,,,
22_08_25 Upper C.txt,22_08_25,Upper C,Weighted Triceps Dips,2.0,,8.0,,,,
22_08_25 Upper C.txt,22_08_25,Upper C,Decline Crunches,1.0,,11.0,,,,f
22_08_25 Upper C.txt,22_08_25,Upper C,Decline Crunches,2.0,,7.0,,,,f
23-09-25 Lower  B.txt,2025-09-23,Lower  B,Barbell Back Squats,1.0,50.0,6.0,,,300.0,"not f, 2-3 sec hold at bottom"
23-09-25 Lower  B.txt,2025-09-23,Lower  B,Barbell Back Squats,2.0,50.0,6.0,,,300.0,ctf same as before
23-09-25 Lower  B.txt,2025-09-23,Lower  B,Barbell RDLs,1.0,30.0,10.0,,,300.0,nf
23-09-25 Lower  B.txt,2025-09-23,Lower  B,Barbell RDLs,2.0,30.0,10.0,,,300.0,nf
23-09-25 Lower  B.txt,2025-09-23,Lower  B,Weighted Pull-Ups,1.0,,5.0,,,,nf
23-09-25 Lower  B.txt,2025-09-23,Lower  B,Weighted Pull-Ups,2.0,,3.0,,,,f ; (Wide feet)
23-09-25 Lower  B.txt,2025-09-23,Lower  B,Leg Press,1.0,120.0,8.0,,,960.0,nf
23-09-25 Lower  B.txt,2025-09-23,Lower  B,Leg Press,2.0,120.0,8.0,,,960.0,nf
23-09-25 Lower  B.txt,2025-09-23,Lower  B,Lying Hamstring Curls,1.0,15.0,6.0,,,90.0,nf
23-09-25 Lower  B.txt,2025-09-23,Lower  B,Lying Hamstring Curls,2.0,15.0,8.0,,,120.0,nf
23-09-25 Lower  B.txt,2025-09-23,Lower  B,Seated Calf Raises,1.0,15.0,10.0,,,150.0,ctf
23-09-25 Lower  B.txt,2025-09-23,Lower  B,Seated Calf Raises,2.0,15.0,10.0,,,150.0,ctf
23-09-25 Lower  B.txt,2025-09-23,Lower  B,Plank,1.0,,,90.0,,,f
23-09-25 Lower  B.txt,2025-09-23,Lower  B,Plank,2.0,,,60.0,,,ctf
23-09-25 Lower  B.txt,2025-09-23,Lower  B,Elbow-Supported Leg Raises,1.0,,20.0,,,,
23-09-25 Lower  B.txt,2025-09-23,Lower  B,Elbow-Supported Leg Raises,2.0,,15.0,,,,
23-10-25 Lower  B.txt,2025-10-23,Lower  B,Cable Tricep Pushdowns,1.0,25.0,11.0,,,275.0,f
23-10-25 Lower  B.txt,2025-10-23,Lower  B,Cable Tricep Pushdowns,2.0,25.0,9.0,,,225.0,f
23-10-25 Lower  B.txt,2025-10-23,Lower  B,Cable Hammer Curls,1.0,25.0,7.0,,,175.0,f
23-10-25 Lower  B.txt,2025-10-23,Lower  B,Cable Hammer Curls,2.0,25.0,5.0,,,125.0,f
23-10-25 Lower  B.txt,2025-10-23,Lower  B,Lying Hamstring Curls,1.0,25.0,6.0,,,150.0,f
23-10-25 Lower  B.txt,2025-10-23,Lower  B,Lying Hamstring Curls,2.0,25.0,5.0,,,125.0,f
23-10-25 Lower  B.txt,2025-10-23,Lower  B,Seated Calf Raises,1.0,20.0,8.0,,,160.0,f
23-10-25 Lower  B.txt,2025-10-23,Lower  B,Seated Calf Raises,2.0,20.0,7.0,,,140.0,f
23-10-25 Lower  B.txt,2025-10-23,Lower  B,Barbell Back Squats,1.0,72.0,9.0,,,648.0,f
23-10-25 Lower  B.txt,2025-10-23,Lower  B,Barbell Back Squats,2.0,72.0,4.0,,,288.0,f
23-10-25 Lower  B.txt,2025-10-23,Lower  B,Barbell RDLs,1.0,62.0,6.0,,,372.0,"f, with straps and belt, no MMC"
23-10-25 Lower  B.txt,2025-10-23,Lower  B,Barbell RDLs,2.0,,56.0,,,,still same as before ; (Wide feet)
23-10-25 Lower  B.txt,2025-10-23,Lower  B,Leg Press,1.0,150.0,6.0,,,900.0,f
23-10-25 Lower  B.txt,2025-10-23,Lower  B,Leg Press,2.0,150.0,4.0,,,600.0,f
23-10-25 Lower  B.txt,2025-10-23,Lower  B,Plank,1.0,,,67.0,,,
23-10-25 Lower  B.txt,2025-10-23,Lower  B,Plank,2.0,,,,,,(skipped)
23-10-25 Lower  B.txt,2025-10-23,Lower  B,Elbow-Supported Leg Raises,1.0,,10.0,,,,f
23-10-25 Lower  B.txt,2025-10-23,Lower  B,Elbow-Supported Leg Raises,2.0,,,,,,(skipped)
23_07_25 Torso B.txt,23_07_25,Torso B,Lat Pulldown,1.0,45.0,9.0,,,405.0,failure
23_07_25 Torso B.txt,23_07_25,Torso B,Lat Pulldown,2.0,50.0,7.0,,,350.0,failure
23_07_25 Torso B.txt,23_07_25,Torso B,T-Bar Rows,1.0,40.0,6.0,,,240.0,failure
23_07_25 Torso B.txt,23_07_25,Torso B,T-Bar Rows,2.0,40.0,6.0,,,240.0,f
23_07_25 Torso B.txt,23_07_25,Torso B,Straight-Arm Cable Pullover,1.0,20.0,9.0,,,180.0,failure
23_07_25 Torso B.txt,23_07_25,Torso B,Straight-Arm Cable Pullover,2.0,22.0,7.0,,,154.0,f
23_07_25 Torso B.txt,23_07_25,Torso B,Dumbbell Lateral Raises,1.0,7.5,12.0,,,90.0,f
23_07_25 Torso B.txt,23_07_25,Torso B,Dumbbell Lateral Raises,2.0,,7.0,,,,f
23_07_25 Torso B.txt,23_07_25,Torso B,Shrugs,1.0,25.0,7.0,,,175.0,f
23_07_25 Torso B.txt,23_07_25,Torso B,Shrugs,2.0,25.0,6.0,,,150.0,f
23_07_25 Torso B.txt,23_07_25,Torso B,Incline Barbell Bench Press,1.0,46.0,8.0,,,368.0,close
23_07_25 Torso B.txt,23_07_25,Torso B,Incline Barbell Bench Press,2.0,48.0,6.0,,,288.0,close
23_07_25 Torso B.txt,23_07_25,Torso B,Chest Pec Deck,1.0,45.0,7.0,,,315.0,close
23_07_25 Torso B.txt,23_07_25,Torso B,Chest Pec Deck,2.0,45.0,6.0,,,270.0,f
23_08_25 Lower D.txt,23_08_25,Lower D,Deadlifts,1.0,100.0,6.0,,,600.0,"ctf, mixed grip, with belt"
23_08_25 Lower D.txt,23_08_25,Lower D,Deadlifts,2.0,100.0,3.0,,,300.0,same as before
23_08_25 Lower D.txt,23_08_25,Lower D,Front Barbell Squats,1.0,20.0,10.0,,,200.0,
23_08_25 Lower D.txt,23_08_25,Lower D,Front Barbell Squats,2.0,20.0,10.0,,,200.0,(used plate at heels so form good)
23_08_25 Lower D.txt,23_08_25,Lower D,Barbell Good Mornings,1.0,20.0,12.0,,,240.0,good MMC
23_08_25 Lower D.txt,23_08_25,Lower D,Barbell Good Mornings,2.0,20.0,12.0,,,240.0,good MMC
23_08_25 Lower D.txt,23_08_25,Lower D,Bulgarian Split Squats,1.0,20.0,12.0,,,240.0,Good MMC
23_08_25 Lower D.txt,23_08_25,Lower D,Bulgarian Split Squats,2.0,30.0,8.0,,,240.0,"f, good MMC"
23_08_25 Lower D.txt,23_08_25,Lower D,Shrugs,1.0,20.0,11.0,,,220.0,f
23_08_25 Lower D.txt,23_08_25,Lower D,Shrugs,2.0,20.0,9.0,,,180.0,f
23_08_25 Lower D.txt,23_08_25,Lower D,Seated Calf Raises,1.0,15.0,12.0,,,180.0,f
23_08_25 Lower D.txt,23_08_25,Lower D,Seated Calf Raises,2.0,15.0,10.0,,,150.0,f
23_08_25 Lower D.txt,23_08_25,Lower D,Reverse EZ Bar Curls,1.0,26.0,10.0,,,260.0,f
23_08_25 Lower D.txt,23_08_25,Lower D,Reverse EZ Bar Curls,2.0,26.0,9.0,,,234.0,"f, rp"
23_08_25 Lower D.txt,23_08_25,Lower D,Cable Tricep Pushdowns,1.0,20.0,9.0,,,180.0,f
23_08_25 Lower D.txt,23_08_25,Lower D,Cable Tricep Pushdowns,2.0,20.0,8.0,,,160.0,f
23_08_25 Lower D.txt,23_08_25,Lower D,Front Wrist Curls,1.0,15.0,11.0,,,165.0,f
23_08_25 Lower D.txt,23_08_25,Lower D,Front Wrist Curls,2.0,15.0,8.0,,,120.0,f
23_08_25 Lower D.txt,23_08_25,Lower D,Side Plank,1.0,,,55.0,,,f
23_08_25 Lower D.txt,23_08_25,Lower D,Side Plank,2.0,,,47.0,,,f ; have light cold can't workout properly
24-10-25 Upper C.txt,2025-10-24,Upper C,Lat Pulldown,1.0,60.0,7.0,,,420.0,f
24-10-25 Upper C.txt,2025-10-24,Upper C,Lat Pulldown,2.0,60.0,5.0,,,300.0,f
24-10-25 Upper C.txt,2025-10-24,Upper C,Incline Barbell Bench Press,1.0,56.0,7.0,,,392.0,"f, last one assigned"
24-10-25 Upper C.txt,2025-10-24,Upper C,Incline Barbell Bench Press,2.0,56.0,5.0,,,280.0,f
24-10-25 Upper C.txt,2025-10-24,Upper C,Incline Barbell Bench Press,3.0,40.0,7.0,,,280.0,f
24-10-25 Upper C.txt,2025-10-24,Upper C,Seated Cable Rows,1.0,50.0,7.0,,,350.0,f
24-10-25 Upper C.txt,2025-10-24,Upper C,Seated Cable Rows,2.0,50.0,6.0,,,300.0,f
24-10-25 Upper C.txt,2025-10-24,Upper C,Weighted Chin-Ups,1.0,,5.0,,,,f
24-10-25 Upper C.txt,2025-10-24,Upper C,Weighted Chin-Ups,2.0,,3.0,,,,f
24-10-25 Upper C.txt,2025-10-24,Upper C,Cable Lateral Raises,1.0,10.0,11.0,,,110.0,f
24-10-25 Upper C.txt,2025-10-24,Upper C,Cable Lateral Raises,2.0,10.0,7.0,,,70.0,f
24-10-25 Upper C.txt,2025-10-24,Upper C,Face Pulls,1.0,20.0,7.0,,,140.0,f
24-10-25 Upper C.txt,2025-10-24,Upper C,Face Pulls,2.0,20.0,5.0,,,100.0,f
24-10-25 Upper C.txt,2025-10-24,Upper C,Weighted Triceps Dips,1.0,5.0,8.0,,,40.0,f
24-10-25 Upper C.txt,2025-10-24,Upper C,Weighted Triceps Dips,2.0,5.0,5.0,,,25.0,f
24-10-25 Upper C.txt,2025-10-24,Upper C,Dumbbell Preacher Curls,1.0,20.0,8.0,,,160.0,f
24-10-25 Upper C.txt,2025-10-24,Upper C,Dumbbell Preacher Curls,2.0,20.0,6.0,,,120.0,f ; (Machine)
24-10-25 Upper C.txt,2025-10-24,Upper C,Front Wrist Curls,1.0,15.0,7.0,,,105.0,f
24-10-25 Upper C.txt,2025-10-24,Upper C,Front Wrist Curls,2.0,6.0,12.0,,,72.0,f) (DB ; (machine fault change workout)
24_07_25 Limbs B.txt,24_07_25,Limbs B,Dumbbell Preacher Curls,1.0,17.0,7.0,,,119.0,f
24_07_25 Limbs B.txt,24_07_25,Limbs B,Dumbbell Preacher Curls,2.0,17.0,6.0,,,102.0,f
24_07_25 Limbs B.txt,24_07_25,Limbs B,Weighted Triceps Dips,1.0,,8.0,,,,f
24_07_25 Limbs B.txt,24_07_25,Limbs B,Weighted Triceps Dips,2.0,,6.0,,,,f ; (total weight including bar 10kg)
24_07_25 Limbs B.txt,24_07_25,Limbs B,Barbell Back Squats,1.0,64.0,6.0,,,384.0,"f, form broke"
24_07_25 Limbs B.txt,24_07_25,Limbs B,Barbell Back Squats,2.0,64.0,4.0,,,256.0,"f, can't get up, used belt"
24_07_25 Limbs B.txt,24_07_25,Limbs B,Dumbbell RDLs,1.0,25.0,6.0,,,150.0,"f, no MMC"
24_07_25 Limbs B.txt,24_07_25,Limbs B,Dumbbell RDLs,2.0,20.0,9.0,,,180.0,"f, lite MMC"
24_07_25 Limbs B.txt,24_07_25,Limbs B,Reverse Cable Curls,1.0,20.0,8.0,,,160.0,f
24_07_25 Limbs B.txt,24_07_25,Limbs B,Reverse Cable Curls,2.0,20.0,6.0,,,120.0,f
24_07_25 Limbs B.txt,24_07_25,Limbs B,Overhead Cable Tricep Extension,1.0,22.0,5.0,,,110.0,f
24_07_25 Limbs B.txt,24_07_25,Limbs B,Overhead Cable Tricep Extension,2.0,15.0,8.0,,,120.0,f ; (no rest in this SS)
24_07_25 Limbs B.txt,24_07_25,Limbs B,Lunges,1.0,15.0,12.0,,,180.0,f
24_07_25 Limbs B.txt,24_07_25,Limbs B,Lunges,2.0,17.5,8.0,,,140.0,f ; —
24_07_25 Limbs B.txt,24_07_25,Limbs B,Lying Hamstring Curls,1.0,20.0,6.0,,,120.0,f
24_07_25 Limbs B.txt,24_07_25,Limbs B,Lying Hamstring Curls,2.0,20.0,5.0,,,100.0,f
24_07_25 Limbs B.txt,24_07_25,Limbs B,Seated Calf Raises,1.0,10.0,16.0,,,160.0,same as below
24_07_25 Limbs B.txt,24_07_25,Limbs B,Seated Calf Raises,2.0,15.0,10.0,,,150.0,"good MMC, no f"
24_07_25 Limbs B.txt,24_07_25,Limbs B,Side Plank,1.0,,,45.0,,,
24_07_25 Limbs B.txt,24_07_25,Limbs B,Side Plank,2.0,,,35.0,,,
25-09-25 Upper C.txt,2025-09-25,Upper C,Lat Pulldown,1.0,45.0,5.0,,,225.0,ctf
25-09-25 Upper C.txt,2025-09-25,Upper C,Lat Pulldown,2.0,45.0,5.0,,,225.0,ctf
25-09-25 Upper C.txt,2025-09-25,Upper C,Lat Pulldown,3.0,45.0,7.0,,,315.0,f
25-09-25 Upper C.txt,2025-09-25,Upper C,Incline Barbell Bench Press,1.0,40.0,6.0,,,240.0,1 RIR
25-09-25 Upper C.txt,2025-09-25,Upper C,Incline Barbell Bench Press,2.0,40.0,6.0,,,240.0,
25-09-25 Upper C.txt,2025-09-25,Upper C,Incline Barbell Bench Press,3.0,40.0,8.0,,,320.0,ctf
25-09-25 Upper C.txt,2025-09-25,Upper C,Seated Cable Rows,1.0,35.0,6.0,,,210.0,
25-09-25 Upper C.txt,2025-09-25,Upper C,Seated Cable Rows,2.0,35.0,10.0,,,350.0,
25-09-25 Upper C.txt,2025-09-25,Upper C,Weighted Chin-Ups,1.0,,4.0,,,,f
25-09-25 Upper C.txt,2025-09-25,Upper C,Weighted Chin-Ups,2.0,,3.0,,,,f
25-09-25 Upper C.txt,2025-09-25,Upper C,Weighted Chin-Ups,3.0,,3.0,,,,f
25-09-25 Upper C.txt,2025-09-25,Upper C,Incline DB Lateral Raises,1.0,5.0,20.0,,,100.0,ctf
25-09-25 Upper C.txt,2025-09-25,Upper C,Incline DB Lateral Raises,2.0,7.5,10.0,,,75.0,f
25-09-25 Upper C.txt,2025-09-25,Upper C,Incline DB Lateral Raises,3.0,7.5,9.0,,,67.5,f
25-09-25 Upper C.txt,2025-09-25,Upper C,Face Pulls,1.0,15.0,15.0,,,225.0,
25-09-25 Upper C.txt,2025-09-25,Upper C,Face Pulls,2.0,15.0,12.0,,,180.0,
25-09-25 Upper C.txt,2025-09-25,Upper C,Face Pulls,3.0,15.0,15.0,,,225.0,f
25-09-25 Upper C.txt,2025-09-25,Upper C,Dumbbell Bench Press,1.0,20.0,7.0,,,140.0,
25-09-25 Upper C.txt,2025-09-25,Upper C,Dumbbell Bench Press,2.0,20.0,6.0,,,120.0,
25-09-25 Upper C.txt,2025-09-25,Upper C,Dumbbell Preacher Curls,1.0,7.5,15.0,,,112.5,
25-09-25 Upper C.txt,2025-09-25,Upper C,Dumbbell Preacher Curls,2.0,10.0,10.0,,,100.0,f
25-09-25 Upper C.txt,2025-09-25,Upper C,Dumbbell Preacher Curls,3.0,10.0,7.0,,,70.0,f
25-09-25 Upper C.txt,2025-09-25,Upper C,Weighted Triceps Dips,1.0,,10.0,,,,f
25-09-25 Upper C.txt,2025-09-25,Upper C,Weighted Triceps Dips,2.0,,7.0,,,,f
25-09-25 Upper C.txt,2025-09-25,Upper C,Weighted Triceps Dips,3.0,,6.0,,,,f
25-10-25 Lower D.txt,2025-10-25,Lower D,Bulgarian Split Squats,1.0,36.0,9.0,,,324.0,f
25-10-25 Lower D.txt,2025-10-25,Lower D,Bulgarian Split Squats,2.0,36.0,6.0,,,216.0,f
25-10-25 Lower D.txt,2025-10-25,Lower D,Deadlifts,1.0,110.0,5.0,,,550.0,"with belt, 4 reps without straps and mixed grip, f"
25-10-25 Lower D.txt,2025-10-25,Lower D,Deadlifts,2.0,110.0,4.0,,,440.0,"with straps and belt, f"
25-10-25 Lower D.txt,2025-10-25,Lower D,Leg Extension,1.0,30.0,7.0,,,210.0,f
25-10-25 Lower D.txt,2025-10-25,Lower D,Leg Extension,2.0,30.0,7.0,,,210.0,f
25-10-25 Lower D.txt,2025-10-25,Lower D,Shrugs,1.0,50.0,6.0,,,300.0,"f, with straps"
25-10-25 Lower D.txt,2025-10-25,Lower D,Shrugs,2.0,50.0,5.0,,,250.0,"f, with straps"
25-10-25 Lower D.txt,2025-10-25,Lower D,Seated Calf Raises,1.0,20.0,15.0,,,300.0,f
25-10-25 Lower D.txt,2025-10-25,Lower D,Seated Calf Raises,2.0,20.0,15.0,,,300.0,f
25-10-25 Lower D.txt,2025-10-25,Lower D,Side Plank,1.0,,,45.0,,,
25-10-25 Lower D.txt,2025-10-25,Lower D,Side Plank,2.0,,,30.0,,,
25-10-25 Lower D.txt,2025-10-25,Lower D,Decline Crunches,1.0,,10.0,,,,
25-10-25 Lower D.txt,2025-10-25,Lower D,Decline Crunches,2.0,,10.0,,,,
26-09-25 Lower D.txt,2025-09-26,Lower D,Deadlifts,1.0,90.0,6.0,,,540.0,
26-09-25 Lower D.txt,2025-09-26,Lower D,Deadlifts,2.0,90.0,8.0,,,720.0,
26-09-25 Lower D.txt,2025-09-26,Lower D,Weighted Pull-Ups,1.0,,3.0,,,,
26-09-25 Lower D.txt,2025-09-26,Lower D,Weighted Pull-Ups,2.0,,3.0,,,,
26-09-25 Lower D.txt,2025-09-26,Lower D,Weighted Pull-Ups,3.0,,2.0,,,,
26-09-25 Lower D.txt,2025-09-26,Lower D,Barbell Good Mornings,1.0,20.0,10.0,,,200.0,
26-09-25 Lower D.txt,2025-09-26,Lower D,Barbell Good Mornings,2.0,20.0,10.0,,,200.0,
26-09-25 Lower D.txt,2025-09-26,Lower D,Bulgarian Split Squats,1.0,20.0,8.0,,,160.0,
26-09-25 Lower D.txt,2025-09-26,Lower D,Bulgarian Split Squats,2.0,20.0,8.0,,,160.0,
26-09-25 Lower D.txt,2025-09-26,Lower D,Shrugs,1.0,50.0,7.0,,,350.0,
26-09-25 Lower D.txt,2025-09-26,Lower D,Shrugs,2.0,50.0,5.0,,,250.0,
26-09-25 Lower D.txt,2025-09-26,Lower D,Seated Calf Raises,1.0,20.0,8.0,,,160.0,
26-09-25 Lower D.txt,2025-09-26,Lower D,Seated Calf Raises,2.0,20.0,8.0,,,160.0,
26-09-25 Lower D.txt,2025-09-26,Lower D,Side Plank,1.0,,,30.0,,,
26-09-25 Lower D.txt,2025-09-26,Lower D,Side Plank,2.0,,,30.0,,,
26-09-25 Lower D.txt,2025-09-26,Lower D,Decline Crunches,1.0,,6.0,,,,
26-09-25 Lower D.txt,2025-09-26,Lower D,Decline Crunches,2.0,,5.0,,,,
26_08_25 Upper A.txt,26_08_25,Upper A,Barbell Bench Press,1.0,64.0,6.0,,,384.0,ctf
26_08_25 Upper A.txt,26_08_25,Upper A,Barbell Bench Press,2.0,,64.0,,,,"f, with rest pause"
26_08_25 Upper A.txt,26_08_25,Upper A,Barbell Bench Press,3.0,50.0,6.0,,,300.0,"f, without rest"
26_08_25 Upper A.txt,26_08_25,Upper A,Barbell Bent Over Rows,1.0,54.0,8.0,,,432.0,f
26_08_25 Upper A.txt,26_08_25,Upper A,Barbell Bent Over Rows,2.0,54.0,6.0,,,324.0,f
26_08_25 Upper A.txt,26_08_25,Upper A,Barbell Bent Over Rows,3.0,40.0,11.0,,,440.0,f
26_08_25 Upper A.txt,26_08_25,Upper A,Weighted Pull-Ups,1.0,,5.0,,,,f
26_08_25 Upper A.txt,26_08_25,Upper A,Weighted Pull-Ups,2.0,,4.0,,,,"f, rest pause"
26_08_25 Upper A.txt,26_08_25,Upper A,Barbell Overhead Press,1.0,40.0,5.0,,,200.0,f
26_08_25 Upper A.txt,26_08_25,Upper A,Barbell Overhead Press,2.0,40.0,7.0,,,280.0,f
26_08_25 Upper A.txt,26_08_25,Upper A,Incline Dumbbell Press,1.0,20.0,10.0,,,200.0,ctf
26_08_25 Upper A.txt,26_08_25,Upper A,Incline Dumbbell Press,2.0,20.0,9.0,,,180.0,ctf
26_08_25 Upper A.txt,26_08_25,Upper A,Dumbbell Lateral Raises,1.0,7.5,15.0,,,112.5,f
26_08_25 Upper A.txt,26_08_25,Upper A,Dumbbell Lateral Raises,2.0,7.5,13.0,,,97.5,f
26_08_25 Upper A.txt,26_08_25,Upper A,Barbell Bicep Curls,1.0,30.0,8.0,,,240.0,f
26_08_25 Upper A.txt,26_08_25,Upper A,Barbell Bicep Curls,2.0,30.0,7.0,,,210.0,f
26_08_25 Upper A.txt,26_08_25,Upper A,Overhead Cable Tricep Extension,1.0,,17.0,,,,f
26_08_25 Upper A.txt,26_08_25,Upper A,Overhead Cable Tricep Extension,2.0,17.0,6.0,,,102.0,f
26_08_25 Upper A.txt,26_08_25,Upper A,Reverse Pec Deck,1.0,40.0,8.0,,,320.0,f
26_08_25 Upper A.txt,26_08_25,Upper A,Reverse Pec Deck,2.0,30.0,15.0,,,450.0,f
26_08_25 Upper A.txt,26_08_25,Upper A,Hanging Knee Raises,1.0,,12.0,,,,
26_08_25 Upper A.txt,26_08_25,Upper A,Hanging Knee Raises,2.0,,11.0,,,,grip f ; (Nuteral grip)
26_08_25 Upper A.txt,26_08_25,Upper A,Lat Pulldown,1.0,60.0,4.0,,,240.0,"f, not perfect form as grip almost sliped"
26_08_25 Upper A.txt,26_08_25,Upper A,Lat Pulldown,2.0,,60.0,,,,f ; (due to low volume because of pull ups
26_08_25 Upper A.txt,26_08_25,Upper A,Dead Hangs,1.0,,,23.0,,,
27-10-25 Upper A.txt,2025-10-27,Upper A,Barbell Bench Press,1.0,64.0,7.0,,,448.0,"f, same as last week"
27-10-25 Upper A.txt,2025-10-27,Upper A,Barbell Bench Press,2.0,64.0,4.0,,,256.0,f
27-10-25 Upper A.txt,2025-10-27,Upper A,Barbell Bench Press,3.0,46.0,12.0,,,552.0,f
27-10-25 Upper A.txt,2025-10-27,Upper A,Weighted Pull-Ups,1.0,5.0,5.0,,,25.0,f
27-10-25 Upper A.txt,2025-10-27,Upper A,Weighted Pull-Ups,2.0,5.0,3.0,,,15.0,f
27-10-25 Upper A.txt,2025-10-27,Upper A,Weighted Pull-Ups,3.0,,2.0,,,,f
27-10-25 Upper A.txt,2025-10-27,Upper A,Lat Pulldown,1.0,50.0,6.0,,,300.0,f
27-10-25 Upper A.txt,2025-10-27,Upper A,Lat Pulldown,2.0,50.0,4.0,,,200.0,f
27-10-25 Upper A.txt,2025-10-27,Upper A,Barbell Overhead Press,1.0,40.0,5.0,,,200.0,"f, 1 Rep drop, with belt"
27-10-25 Upper A.txt,2025-10-27,Upper A,Barbell Overhead Press,2.0,40.0,3.0,,,120.0,"f, with belt"
27-10-25 Upper A.txt,2025-10-27,Upper A,Barbell Bent Over Rows,1.0,60.0,7.0,,,420.0,"f, with straps and belt"
27-10-25 Upper A.txt,2025-10-27,Upper A,Barbell Bent Over Rows,2.0,56.0,7.0,,,392.0,"f, with straps and belt"
27-10-25 Upper A.txt,2025-10-27,Upper A,Incline DB Lateral Raises,1.0,7.5,10.0,,,75.0,f
27-10-25 Upper A.txt,2025-10-27,Upper A,Incline DB Lateral Raises,2.0,7.5,9.0,,,67.5,f
27-10-25 Upper A.txt,2025-10-27,Upper A,Incline DB Lateral Raises,3.0,7.5,8.0,,,60.0,f
27-10-25 Upper A.txt,2025-10-27,Upper A,1-Arm Reverse Pec Deck,1.0,30.0,6.0,,,180.0,f
27-10-25 Upper A.txt,2025-10-27,Upper A,1-Arm Reverse Pec Deck,2.0,30.0,5.0,,,150.0,f ; (V - Bar)
27-10-25 Upper A.txt,2025-10-27,Upper A,Overhead Cable Tricep Extension,1.0,20.0,5.0,,,100.0,f
27-10-25 Upper A.txt,2025-10-27,Upper A,Overhead Cable Tricep Extension,2.0,20.0,5.0,,,100.0,f
27-10-25 Upper A.txt,2025-10-27,Upper A,Overhead Cable Tricep Extension,3.0,20.0,4.0,,,80.0,f
27-10-25 Upper A.txt,2025-10-27,Upper A,Cable Bicep Curls,1.0,30.0,6.0,,,180.0,f
27-10-25 Upper A.txt,2025-10-27,Upper A,Cable Bicep Curls,2.0,30.0,4.0,,,120.0,f
27-10-25 Upper A.txt,2025-10-27,Upper A,Cable Bicep Curls,3.0,30.0,3.0,,,90.0,f ; (Barbell)
27-10-25 Upper A.txt,2025-10-27,Upper A,Front Wrist Curls,1.0,15.0,11.0,,,165.0,f
27-10-25 Upper A.txt,2025-10-27,Upper A,Front Wrist Curls,2.0,15.0,8.0,,,120.0,f
27-10-25 Upper A.txt,2025-10-27,Upper A,Front Wrist Curls,3.0,15.0,7.0,,,105.0,f
27-11-25 Upper A.txt,2025-11-27,Upper A,Barbell Bench Press,1.0,70.0,4.0,,,280.0,RIR
27-11-25 Upper A.txt,2025-11-27,Upper A,Barbell Bench Press,2.0,70.0,6.0,,,420.0,"f, last 2 assisted"
27-11-25 Upper A.txt,2025-11-27,Upper A,Chest Pec Deck,1.0,50.0,6.0,,,300.0,RIR ; (wide grip)
27-11-25 Upper A.txt,2025-11-27,Upper A,Lat Pulldown,1.0,60.0,7.0,,,420.0,"f, with straps"
27-11-25 Upper A.txt,2025-11-27,Upper A,Lat Pulldown,2.0,60.0,5.0,,,300.0,"f, with straps"
27-11-25 Upper A.txt,2025-11-27,Upper A,Seated DB Overhead Press,1.0,20.0,4.0,,,80.0,f
27-11-25 Upper A.txt,2025-11-27,Upper A,Seated DB Overhead Press,2.0,20.0,6.0,,,120.0,f
27-11-25 Upper A.txt,2025-11-27,Upper A,Barbell Bent Over Rows,1.0,60.0,7.0,,,420.0,f
27-11-25 Upper A.txt,2025-11-27,Upper A,Barbell Bent Over Rows,2.0,60.0,5.0,,,300.0,f
27-11-25 Upper A.txt,2025-11-27,Upper A,Dumbbell Lateral Raises,1.0,10.0,7.0,,,70.0,f
27-11-25 Upper A.txt,2025-11-27,Upper A,Dumbbell Lateral Raises,2.0,10.0,6.0,,,60.0,f
27-11-25 Upper A.txt,2025-11-27,Upper A,1-Arm Reverse Pec Deck,1.0,35.0,3.0,,,105.0,f
27-11-25 Upper A.txt,2025-11-27,Upper A,1-Arm Reverse Pec Deck,2.0,30.0,6.0,,,180.0,f ; (V - Bar)
27-11-25 Upper A.txt,2025-11-27,Upper A,Overhead Cable Tricep Extension,1.0,22.5,8.0,,,180.0,f
27-11-25 Upper A.txt,2025-11-27,Upper A,Overhead Cable Tricep Extension,2.0,22.5,6.0,,,135.0,f
27-11-25 Upper A.txt,2025-11-27,Upper A,Cable Bicep Curls,1.0,35.0,5.0,,,175.0,f
27-11-25 Upper A.txt,2025-11-27,Upper A,Cable Bicep Curls,2.0,35.0,3.0,,,105.0,
27-11-25 Upper A.txt,2025-11-27,Upper A,Cable Bicep Curls,3.0,30.0,1.0,,,30.0,f ; (cable)
27-11-25 Upper A.txt,2025-11-27,Upper A,Front Wrist Curls,1.0,30.0,20.0,,,600.0,f
27-11-25 Upper A.txt,2025-11-27,Upper A,Front Wrist Curls,2.0,30.0,14.0,,,420.0,f
28-10-25 Lower  B.txt,2025-10-28,Lower  B,Cable Hammer Curls,1.0,30.0,6.0,,,180.0,f
28-10-25 Lower  B.txt,2025-10-28,Lower  B,Cable Hammer Curls,2.0,30.0,4.0,,,120.0,f
28-10-25 Lower  B.txt,2025-10-28,Lower  B,Cable Hammer Curls,3.0,30.0,4.0,,,120.0,f
28-10-25 Lower  B.txt,2025-10-28,Lower  B,Lying Hamstring Curls,1.0,25.0,5.0,,,125.0,f
28-10-25 Lower  B.txt,2025-10-28,Lower  B,Lying Hamstring Curls,2.0,25.0,4.0,,,100.0,f
28-10-25 Lower  B.txt,2025-10-28,Lower  B,Seated Calf Raises,1.0,20.0,10.0,,,200.0,f
28-10-25 Lower  B.txt,2025-10-28,Lower  B,Seated Calf Raises,2.0,20.0,8.0,,,160.0,f
28-10-25 Lower  B.txt,2025-10-28,Lower  B,Barbell Back Squats,1.0,74.0,7.0,,,518.0,"f, with belt"
28-10-25 Lower  B.txt,2025-10-28,Lower  B,Barbell Back Squats,2.0,74.0,4.0,,,296.0,"f, with belt"
28-10-25 Lower  B.txt,2025-10-28,Lower  B,Barbell RDLs,1.0,50.0,15.0,,,750.0,
28-10-25 Lower  B.txt,2025-10-28,Lower  B,Barbell RDLs,2.0,,,,,,skipped lower back hurt ; (Wide feet)
28-10-25 Lower  B.txt,2025-10-28,Lower  B,Leg Press,1.0,150.0,7.0,,,1050.0,f
